comment_author,comment_likes,comment_text,video_id
@drkgodes1313,0,"As a black woman born, raised, and still living in Texas... THIS is the way America has always been. THIS is the America we tried warning everyone else about, but was instead gaslit. Now, do y'all see what we've been saying all along? I'm so happy we have smartphones now, because we were also constantly gaslit about people calling us the n word and being hostile. Hope everyone wakes up to this and make a real change in this country. America needs to deal with it's racism problem, and stop pretending it doesnt exist.",N92xx_lf8zQ
@1QueenAliquippa,0,Wtf!? Sick! Imagine how they treat black inmates!,N92xx_lf8zQ
@badbeetle2942,0,Dang,N92xx_lf8zQ
@thedavidpakmanshow,1963,Demand Congress kick the DOGE team out of government! https://atadvocacy.com/dckdtog2525?ref=dp,YWuTdSGJHaU
@lestvee4948,1,"I NEED YOUR COMMENTS AND ADVICE… 
I'm a 55yr old American male. And I want out of the US. Away from all these fat ignorant people and completely phsycotic cops.
I'm an aircraft mechanic. I'm intersted in immigrating to:
Italy, Canada(although its too cold there for me. I Love desert climates), Thailand, Malaysia, Germany, maybe Scotland, or other recommendations from basically Europe, Asia, Central America.

I'd like cheap cost of living, good healthy tasty food, and cheap medical care, easy immigration laws, friendly people, dog lovers.

LET ME HEAR IT! Give me details please. Thank you all in advance!",YWuTdSGJHaU
@oneslice5059,1,"Sad, but I agree. Stephen Miller and tRump are on par with the devil: next level evil and insanely cruer😖❗",YWuTdSGJHaU
@ytbpaattty,1,a lack of empathy for others is at the root of all of this. americans let the anti-woke movement get to their head and legitimize oppression on a scale like it hadnt been legitimized since WWII,YWuTdSGJHaU
@quilmesdave,1,"I'm a naturalized citizen. I just came back from a trip that lasted 2 weeks and I visited 8 countries. Europe and the Arabic Peninsula. It's all bullshit. When I showed my passport overseas, I walked and past breezed the lines of ""other citizens"" coming to those countries. When I got back to Los Angeles, it took me 10 minutes to pass immigration. STOP SCARING PEOPLE!!! If you have done nothing wrong, there's nothing to fucking fear. I didn't vote nor I'm a fan of Trump.",YWuTdSGJHaU
@tonialexander3810,1,"I am leaving America in 2027.
She has lost her salt and not worth living here anymore.",YWuTdSGJHaU
@Cmj-f1u,1,Come to the UK guys your welcome in my book,YWuTdSGJHaU
@dustup2249,1,That would be funny if you actually made enough money working out of your mom's basement doing these inane podcasts for your clickbait to be true so you could cause an international incident and be interviewed by CNN and MSDNC while Chuck Schumer held your hand in the visitor's room in El Salvador's CECOT while you cried happy tears that you had a starring role in the anti-Trump movement ,YWuTdSGJHaU
@jackseve,1,Don’t doubt it. I believe it can be an issue for those BORN here to travel internationally. There is NO way to know with the state of this country.,YWuTdSGJHaU
@DarkHelixia,1,"If you leave Trump's America, in all honesty, why would you return?",YWuTdSGJHaU
@Grungegarage1955,1,As a black American who was born to American parents my mom told me to keep my birth certificate in my car with me where ever I go I’m scared for my safety even tho im a citizen from birth born to American parents,YWuTdSGJHaU
@edwinpoon,1,"Never thought America would become Nazi America. You Americans will soon be saying ""Hail Hitler!"" to Trump soon.",YWuTdSGJHaU
@olenaverbova9720,1,"All this talk is complete BS, you are the one who is trying to scare people.",YWuTdSGJHaU
@PhiLLyPhiLLz,0,"I’m also a naturalized citizen, I pay my taxes and obey the laws. So everyone can kiss my ass.",YWuTdSGJHaU
@45n712ghfj,0,"Ok, so you are telling that they eat cats and dogs but it is Left version instead?",YWuTdSGJHaU
@anneroberts15,0,Democracy is dead in America,YWuTdSGJHaU
@sidrat2009,0,"When more than half the voters of a nation vote for fear and hate, everyone should be afraid and a lot of people will continue to hate.  Just not aimed where it matters.",YWuTdSGJHaU
@plantmanstudios,0,I was born here. Sucks to be you second hand citizen😢,YWuTdSGJHaU
@markrcca5329,0,"I have tons of immigrant citizen friends and I haven't heard any issues from anyone.  Maybe there is some small chance  someone could get questioned for a few hours at the re-entry border.    Fine.  This is not going to stop me from traveling.   if you are so scared and want to be alarmist  - don't travel, I really don't care.",YWuTdSGJHaU
@SolutionsSolved,0,5:47 the lab leak theory??? I thought that was well documented 😂,YWuTdSGJHaU
@48hours,73,Click here to watch more “48 Hours” full episodes: https://youtube.com/playlist?list=PLcFHkKbd_jTJiRmfUfLX2Ay_hnf5j3cxH,NqTNmUeVo54
@chouaher7406,6,I can’t imagine the pain his parents must’ve felt knowing that their son was the one who killed them.,NqTNmUeVo54
@MoroMoro1,5,"The lady in new orleans that went to the hotel room with him and saw how he barricaded his room, and STILL didn't think something was off with him is EXACTLY the type to be murdered by a lunatic for ignoring every single warning sign.",NqTNmUeVo54
@ashleyj0,3,Personally.. i'd never trust a person with teeth that white 😅😅,NqTNmUeVo54
@DLiteArts,2,"I'm sorry, but if the daughter kept calling and calling-- why did she wait SIX OR SEVEN DAYS to ask her brother if he had seen them? She didn't call for a welfare check or anything within those days, either? 
Why wasn't she re-assessed tor involvement after they realized Ernie did it? 
She didn't have to be present to be involved in the plan. She also benefited financially from their death. Her calling over and over coule be a potential cover story.

Through this whole episode, I kept waiting for them to go back to her, but they didn't. Why did she wait SIX OR SEVEN DAYS? I can't get over that part. 

I'm not saying she was ""definitely involved."" I'm just shocked she wasn't reconsidered as an accomplice for the reasons listed above to know for sure.",NqTNmUeVo54
@memorymiyoba3358,2,Giving birth to someone who will end up unaliving you is the worst form of betrayal 💔💔💔,NqTNmUeVo54
@josephzacharias7992,2,Dude was a professional money losing addict,NqTNmUeVo54
@sherrimartin4775,2,"Greed and narcissism took him down.  Oh, and the fact he has no soul.",NqTNmUeVo54
@sylviayoung9009,2,Wow! The mistress is not close to being as fabulous as his wife.,NqTNmUeVo54
@luluxa2011,2,"Out of all women he was with, his wife was the most beautiful.",NqTNmUeVo54
@heathermetz3974,2,"Woman who went on camera but declined to give her name, silly. The interviewer must be thinking, “She’s nuts.”",NqTNmUeVo54
@heathermetz3974,2,“The nauseating comments went from there.” Detective on reading Ernie Jr’s Craigslist dating ads.,NqTNmUeVo54
@ninaballerina2807,1,"Nothing good can come from an arrogant human.  Full of pride, such people can have absolutely no regard for their fellow beings, never mind who they are.  There is nothing more satanic.  And to think today's society actually demands that all parents raise their children exactly in the same fashion.",NqTNmUeVo54
@WibblyyWobblyy,1,The lady from New Orleans is.. insane. Her demeanor makes me so uncomfortable; what a weird lady.,NqTNmUeVo54
@avalonheather1071,1,I watch these story's & everytime I'm just in shock over how unfathomably selfish some people are.,NqTNmUeVo54
@debl9957,1,Wife way more attractive than the multiple GFs.,NqTNmUeVo54
@Case0DarkTruthFiles,1,This video is amazing and so captivating! Thanks for making it. Wishing everyone a peaceful and lovely day!,NqTNmUeVo54
@ef9208,1,"Certain ""kind"" of man only attract to certain ""type"" of woman. Normally, it does not end well.",NqTNmUeVo54
@LN-jr6nj,1,Would’ve never guessed he liked ladies by looking at him,NqTNmUeVo54
@Flip-Da-Script,1,Somebody missed a few bible studies.,NqTNmUeVo54
@1classyldy,38,Compremos Productos Mexicanos!!!  Siii se puede y mejor❤❤❤❤,Y1BPhsBMbIo
@mariamartatorre1924,3,Que gusto escucharte...tienes toda la razón,Y1BPhsBMbIo
@JAIRODIAZ-c3b,1,"Analisis profundo, sencillo y muy coherente de la realidad. Excelente",Y1BPhsBMbIo
@nelidacosta3037,1,Extraordinario  análisis!!!!,Y1BPhsBMbIo
@aldolopez8541,1,"Según el último relevamiento del Ministerio de Educación de la República Popular China, en el año 2.024 egresaron de las universidades chinas 10.470.698 estudiantes, de los cuales más de 5 millones son efresados en ciencias duras, entre licenciados e ingenieros. Esto pasa todos los años. Digan ustedes, ¿cómo se puede detener semejante maquinaria de profesionales altamente calificados? Aparte, ya es conocida por todos la excelencia de la educación superior en China. ¿Quién para esto? ¿Un triste geronte, agresivo e inconsciente, que por azar es presidente de los Estados Unidos? Estados Unidos (ni ningún otro país) tiene la más mínima chance de competir con semejante fuerza de trabajo profesionalizada. Olvídense. No hay ninguna posibilidad de nada.",Y1BPhsBMbIo
@anabelguadalupewoo-crespo107,1,"China, tiene una base muy fuerte, ssbe trabajar en equipo y es perseverante. El no pelea, actua.",Y1BPhsBMbIo
@yamiracalderon5130,1,Definitivamente China no tiene que hacer guerra es la fábrica del mundo y Estados Unidos para levantar su economía siempre hace guerra .,Y1BPhsBMbIo
@tonyvalenz2843,1,"va mas halla de lo industrial , la situacion es muy peligrosa ,Dios nos guarde de caer bajo un regimen comunista despiadado",Y1BPhsBMbIo
@leonorvallejo115,1,También México tiene grandes artesanos y   grandes fábricas lo hecho en México esta bien  hecho hay que consumir  nuestros productis,Y1BPhsBMbIo
@enriquetagonzalez9395,1,Que interesante vamos a ver qué va hacer EU ante tal problema qué se echó encima,Y1BPhsBMbIo
@juanluisrivas6817,0,Que México aprenda de china .. tenemos mucho potencial...sabemos trabajar y somos muy prácticos además usamos mucho la inventiva,Y1BPhsBMbIo
@JuanitaCruz-qe9ch,0,"!!! Gracias a Dios los Chinos ya están abarcando toda Sudamérica.
Los admiró por que son súper listos., ordenados desde niños.
Me encanta esa cultura.alli sí se respeta la longevidad.aqui en europa los ancianos van a un asilo dónde hay 2 celadores por la noche cuidandolos, los dopan para que duerman.....y nosotros los que venimos de afuera nos toca hacer el trabajo de cuidarlos cómo sí fueran nuestra familia, con mucho Amor, delicadeza y ante todo mucha humildad.
Los chinos siempre serán una buena cultura .por que aprenden desde Casa los principios morales.
❤",Y1BPhsBMbIo
@lorenaplateada47,0,Es que China esta en otro nivel,Y1BPhsBMbIo
@mercedesgurdian375,0,Creo que hay q dar tiempo al tiempo,Y1BPhsBMbIo
@BellanidesGutierrezSegura,0,"China todo imita, pero es de mala calidad  hay k tener cuidado con sus productos. Es para los k no saben k no son  originakes",Y1BPhsBMbIo
@GuillermoArboledaEdured,0,No hay forma de ganarla y menos subestimando a sus pares y mostrando su estatura moral como lacayo de Putin.,Y1BPhsBMbIo
@aracellycorrea5038,0,"Mientras que EEUU está hostigando al mundo, los chinos están creando, trabajando y progresando, por eso son ya una potencia, lo que EEUU no puede aceptar.",Y1BPhsBMbIo
@rosemarybeitia4212,0,"Estoy de acuerdo con usted, Trump llegó para destruír a Estados Unidos, creó que nunca pensó lo mal que a quedado.",Y1BPhsBMbIo
@enriquepadills5441,0,"Los puertos chinos están colapsados llenos de mercancía. No te equivoques, el costo lo va a pagar china. Ya basta de que china saco a su gente de la pobreza llevándose el dinero de estados unidos y del mundo.",Y1BPhsBMbIo
@mel6688,0,Donald Trump y Las Mil Maneras de Doblarse.,Y1BPhsBMbIo
@divinecommerce3912,3,Kids with special pronouns ARE GR00M1NG VICTIMS ❌🤡❌,xvybT53FNRo
@donaldmacleod7808,1,Now Rosie O'Donnell looks like Polly walnuts from The sopranos with a ginormous head!!??? If she's ever changed her kid once by herself she would easily know what gender it is Wake up.... McFly ....anybody home,xvybT53FNRo
@BMAN33BC,1,"Non binary child? These people are disgusting, and she shouldn't be allowed to have a child... PERIOD",xvybT53FNRo
@BMAN33BC,1,"Non binary child? These people are disgusting, and she shouldn't be allowed to have a child... PERIOD",xvybT53FNRo
@Triumphs1962,1,"Rosie I’m sure you changed your child’s diapers. Did the child have a penis or a vagina? Rosie listen closely, if you saw a penis it’s a boy, if you saw a vagina it’s a girl. Now wasn’t that easy?",xvybT53FNRo
@dannyvillasenor9959,1,Such a liar. She has been leaving since Trump 2016 presidential victory. Rosie the 🐖,xvybT53FNRo
@CherylCarr-dy5iy,1,Are ALL democrats totally insane.????????????,xvybT53FNRo
@Paulie-v2t,1,Let's be clear. Rosie ran away because she's on the Epstein list or the Diddy list. Possibly both.,xvybT53FNRo
@yasureyabetcha,1,"She talks like a drone, no emotion, just cold hatred for anyone who isn't a freakshow like her.",xvybT53FNRo
@josebach9377,1,A bitter hateful woman.,xvybT53FNRo
@smf2072,0,"WOW, lookin good & thinkin clearly Rosie! It's hard to believe you were a funny comic & had a sense of humor in the late 80's.
Glad to hear you & ""it"" are some other counties pain in the ass now....its to bad you won't stop broadcasting in the US & just fade away.",xvybT53FNRo
@robertbowers9856,0,This lady is really screwed up! Dems are the ones attempting to destroy our country!,xvybT53FNRo
@jessegardner1013,0,thank god she left she really is stupid,xvybT53FNRo
@GregBraum-i2i,0,"If only news outlets had more productive and informative content. While the lefties are insane, it would appear conservative media have nothing else to report on than lefties behavior. Lefties control news content, and that's sad.",xvybT53FNRo
@tomasdigio2410,0,Your therapist. Should leave with you rosie,xvybT53FNRo
@LorraineBrown-t7m,0,Rosie - a mouth without a brain.,xvybT53FNRo
@carolphillips8802,0,"I hope, Rita, that you are not inferring that the Irish protecting unborn children after 12 weeks is bad. All the unborn should be protected. ALL of them.",xvybT53FNRo
@margiehankins-jerde6094,0,Warren is a liar and has corrupt as you can get. She is all about money for herself.,xvybT53FNRo
@teribejarano,0,I believe Caitlin is a he-she.,xvybT53FNRo
@kenscall,0,"She's a wack job, why is she still getting air time?",xvybT53FNRo
@GraceFlor-gf5sz,0,Puro ego,Bv_UC2hVrIk
@andreagonzalez9886,0,"Amó !!!! 💕💕💕💕 A China!!! Es un País!!!! Amó todoos sus textiles!!! Ropa!!!! Son geniales!!! S, alpargatas!",Bv_UC2hVrIk
@laurafernandezavalos262,0,"No es novedad, los únicos q se lo creen son los ricos 😂",Bv_UC2hVrIk
@nanfabmendoza3416,0,"Que bueno, una sopa de su propio chocolate para los gandayas usa 🇺🇸 ! 😅. Mil veces lo hecho en México que está bien hecho y de calidad  👍🏻",Bv_UC2hVrIk
@belisariocorcino4167,0,Muchos años atrás se sabía k esto se fabricaba en china y casi todo jos electrónicos k se venden en  USA es hecho en China,Bv_UC2hVrIk
@vicenteramirez1000,0,"Yo siempre he dicho a la gente que presume vestir de marcas de diseñador ,,que todo está hecho en china y miren no me equivoqué. 

Por eso no compren marcas . Usen lo que les quede bien ,lo principal es la percha .
Tenía un jefe bien feo y vestía de marca y usaba las lociones más caras pero seguía igual de feo .
Pero eso sí le decía yo ,feo pero hueles rico 😅😅😅😅😅",Bv_UC2hVrIk
@ElizabethMota-x1w,0,Bravo x el chinito dice EUA k muy acá  y su fraude de. Eua  y Trump dan asco,Bv_UC2hVrIk
@quiquealonso2873,0,🇨🇳productos tóxicos ☠️yo prefiero pagar un poco más..💰🤷🤷🤷🤷,Bv_UC2hVrIk
@Jurez65,0,Y la gente dejapen pagando miles de pesos  jajaj,Bv_UC2hVrIk
@electricpack3278,0,No es mingun seceeto....todo el mundo sabe .....de que hablas!,Bv_UC2hVrIk
@pelonchas559,0,"Siempre lo eh dicho si compran marcas caras pagan por el nombre y no el artículo , dirán que no las compro por que no tengo con que pero tengo gustos más caros 😅😅😅",Bv_UC2hVrIk
@henrysanchez8136,0,"Jajajaja.  Totalmente irrelevante Ningúna de esas marcas son Americanas, que lloren los Franceses 
Jajajaja",Bv_UC2hVrIk
@oh4811,0,"Eso ya se sabía... Tan solo vayan a las tiendas de ropa de alta gama y chequen etiquetas.

Son chinaaaaaas.

Por eso jamás invertí en ropa de ese tipo, mejor consumir lo nacional y hecho a mano.
Es más barato y dura más.",Bv_UC2hVrIk
@Olvasquez-n2d,0,No vuelvo a comprar nunca más mejor guardaré mis 100 pesos que estaba ahorrando para comprarla😊,Bv_UC2hVrIk
@rosalinareyesesquivel8146,0,EEUU. Siempre.trabaja mas limpio .y leal. Sobre todo  . Fiel al Dios Creador.qué  China,Bv_UC2hVrIk
@JosePerez-iz8hg,0,Ya era tiempo,Bv_UC2hVrIk
@RuRu-o6y,0,😂😂😂😂😂😂😂😂😂😂😂😂😂😂😂😂😂😂😂😂😂😂😂😂😂😂😂😂😂😂😂😂😂😂,Bv_UC2hVrIk
@nathanpool8442,0,A WEBO,Bv_UC2hVrIk
@ToyotaCambri,0,Osea que a fin de cuentas usa se aprovecha de china y mucho💰💰💰,Bv_UC2hVrIk
@ToyotaCambri,0,Consumamos hecho en México y alludamos a nuestros artesanos,Bv_UC2hVrIk
@zenmaster4829,2,Us has already loose the trade wae against china and trump is begging to china about making a deal while China doesn't give a fuck.,nKgRjj4BV5U
@jayaskin2808,2,Yeah scared shitless...lol Donnie folds...AGAIN.,nKgRjj4BV5U
@Chrissywhittaker,1,"Our plastic, milk bottles, go to China, and come back as Mc Donald, toy,s when you order kid,s meal, ❤",nKgRjj4BV5U
@ulsterprodspb,1,Sounds good but America these days isn’t very reliable.,nKgRjj4BV5U
@ezra136,1,"What seems to be overlooked in this conversation is the magnitude of the situation—this isn’t like a corner store closing and a new one opening down the block. We’re talking about a ship—massive, complex, and slow to pivot.
Let’s play out the scenario: say we agree that India is set to become the next “China” in terms of manufacturing and trade dominance. How long will it actually take to keep the rhythm of global trade playing smoothly during that transition?
Surely, we can all agree there will be a lag—production doesn’t ramp up overnight. So here’s the real question: What is the actual timeline for that production shift? Does anyone Talk about this ?",nKgRjj4BV5U
@ajeoa102,1,The CCP bots with the anti-India propaganda in the comment sections are BIG MAD,nKgRjj4BV5U
@jasonworsley7914,1,Scared them so much fast forward 24 hrs from this pod cast. And he is literally cutting the tariffs in half he imposed lol lol. Got it wrong again Patrick and gang,nKgRjj4BV5U
@ElevenHymn,1,Trump just folded to China.  This video aged terribly and it's only a day old.,nKgRjj4BV5U
@fuzicast,1,"keep coping, Trump has no cards. China makes the card and own them. Trump needs to slowly build up US manufacturing, not like this abrupt way.",nKgRjj4BV5U
@ignatcatalin6309,1,🤣🤣🤣🤣🤣🤣🤣🤣🤣🤣🤣 dream on,nKgRjj4BV5U
@prestigewoodworkinginc.9499,1,Adam calling China cheaters now 😂 because the pay lower wages and have children working blah blah blah.. brotha lives in a country with similar ideas.. the irony 😂,nKgRjj4BV5U
@taylormade7959,1,Trump folded like a lawn chair I can’t wait until these idiots address that,nKgRjj4BV5U
@AverageGuy916,0,This didn't age well ..after Trump folded on the tariffs on China 😂😂,nKgRjj4BV5U
@vaidyasethuraman452,0,"America made China into what it is to day technology wise and a factory for the world, now Trum0 has to undo the damage.",nKgRjj4BV5U
@phattomato5617,0,Adam…..what’s your point?,nKgRjj4BV5U
@eddios9018,0,Bunch of idiot only thing America is Great but China is moving way ahead of them Use your head please Why Trump is so afraid of China,nKgRjj4BV5U
@Chrissywhittaker,0,"India , has beautiful , cultures, the ,fabrics, the food, the dyes, amazing,and the beautiful, women, from India, are very humble, I work with them in my job, and we all share our culture,s (from New Zealand, )🇳🇿 have ❤❤",nKgRjj4BV5U
@remedy-d71,0,"Is his Indian wife, Usha, speaking also?",nKgRjj4BV5U
@arthurmendoza6926,0,"Trump needs to do something quick because China is making deals with Central America Mexico, Canada NATO UK South Africa, South Korea, India, other countries",nKgRjj4BV5U
@cynthiaguerra6067,0,India all the way. Making India Great Again!!! China wants to break us nope we will use a country that will work with us.....,nKgRjj4BV5U
@ΦίλοςΤουΑλήθειας,2,Thank you Senator Kennedy for stating the position of the vast majority of concerned Americans.,sVraA9BthzM
@CriticalClay03,1,The lack of scalps collected from The House and DOJ will be costly when the mid terms roll around.,sVraA9BthzM
@Bunny-cz5wo,1,Thank you Mr Kennedy for being there for a country and the people of this country. God Bless You ❤️🙏🇺🇸🇺🇸,sVraA9BthzM
@JudyJenkins-h6g,1,We are spending too much on illegal citizens.  Stop the madness. This guy has no rights in America.,sVraA9BthzM
@ROBERT-e1h,1,How come none of these News outlets were doing this to the Biden administration when they were doing stuff everyday and most of the time it was hundreds of times as worse than accidentally deporting MS-13 gang member.,sVraA9BthzM
@esmeralda-yo8sl,0,"I think its evident that when it comes to screw ups, they have been happening since time immemorial, how many innocent men and women have been sent to jail for years because of screw ups? Their lives disrupted and their youth stolen from them. I am not saying its ok for screw up’s to happen, but they do.
A man was deported and sent to jail with members of his gang, he kept in touch with other gang members, he was given enough lawyers to prove his innocence, senator J Kennedy says five million dollars was spent on his defence at the tax payers dollar. I will take the senator’s word that it was a screw up, a case of the wrong place at the wrong time with very bad company, maybe the man was no longer active in the gang, but he kept their company, I would say he has some blame in the screw up.",sVraA9BthzM
@dextermoore278,0,"President Bukele has already said HE IS NOT RELEASING A MS 13 GANG MEMBER! THIS MAN IS A CITIZEN OF EL SALVADOR THAT'S WHY HE IS IN CECOT, A PRISON IN EL SALVADOR.",sVraA9BthzM
@-thefightingviper5319,0,'since God was a child' bahahahahahaha,sVraA9BthzM
@nevernine2961,0,Go back to your home land and make your AMERICA IN YOUR OWN LAND!!!!!!,sVraA9BthzM
@nevernine2961,0,"No illegal aliens have AMERICAN CIVIL RIGHTS,!!!! THEY ARE NOT CITIZENS OF AMERICA!!!",sVraA9BthzM
@nevernine2961,0,"They are not citizens of the United States of America and there for have no AMERICAN CIVIL RIGHTS,!!!  THOUSE ARE FOR AMERICAN CITIZENS!!! NOT ILLEGAL PEOPLE THAT ARE BREAKING THE UNITED STATES OF AMERICA, S LAWS!!!!! THEY DIDN'T HAVE AMERICAN RIGHTS IN THEIR OWN COUNTRY!!!! CROSSING THE BORDER ILLEGALLY DON'T GIVE YOU AMERICAN CITIZENS RIGHTS EVER, UNTILL THEY BECOME AMERICAN CITIZENS.!!!!!!!THE LEAGEL WAY, LIKE ITS ALWAYS BEEN!!!!!",sVraA9BthzM
@csbgky144,0,"Sen. Kennedy: You're the screw-up, ignorant on the issue, done more damage to the GOP.",sVraA9BthzM
@carlahoglund8713,0,I see a pattern of Bidens threat to democracy by ALLOWING illegals to enter without vetting!! Why is this not looked into?? We know why!!! That’s why Trump won!!! 🇺🇸,sVraA9BthzM
@CK-iw5bn,0,The Democrats will waste our tax dollars on an MS 13 gang member yet nothing for a hero like Penny. Garcia is an illegal and a  gang banger. Period.,sVraA9BthzM
@bcham6567,0,"Kristen: “Trump bad”

Also Kristen: “Let me change gears here…Trump bad”",sVraA9BthzM
@RogerAllen-i8g,0,He is a citizen of El Salvador!!,sVraA9BthzM
@samuelmcneil8962,0,Kristen Welker isn't smart enough to report on garbage collection practices in Nowheresville Arkansas. She's a great example of the deterioration of mainstream media.,sVraA9BthzM
@jimbo69416,0,She is not a reporter. She is an activist,sVraA9BthzM
@jimbo69416,0,Democrats have lost their minds and this is one more example of it,sVraA9BthzM
@agapapowers,0,Yes no law follow them,sVraA9BthzM
@crownuk4867,17,"He will ""keep it to himself"" does NOT mean he is not going to ""investigate.""

He is DECIDING not to share WHETHER or not he will ""investigate.""

Quit taking things out of context people.

President Trump WILL get to that",tg0cwGMvMLM
@cmdrx5099,16,President Trump will let it out when its time.,tg0cwGMvMLM
@amorélittrellfellini,15,“Very personal” lmao,tg0cwGMvMLM
@billjoyce5196,11,He’ll keep it to himself because it was a setup.,tg0cwGMvMLM
@roubinamansourian9450,11,MAGA ✊️🇺🇲🚀❤️🙏👏,tg0cwGMvMLM
@DeeBrow,8,A guy with a shielded privately owned business leading a tariff war that impacts publicly traded companies globally,tg0cwGMvMLM
@AndersonDale,8,I can’t understand one word of question—and I’ve listened to this like 12 times.  A little explanation would be nice otherwise just a dumb sounding clown snd and a bunch of barking seals.,tg0cwGMvMLM
@ecat7750,7,"He NEVER got hit by a bullet. He ducked down, slipped out of his elevator shoes (fact) and hit his ear on the podium. Just a nick on the cartilage part that will bleed bad but heal fast. He put that BS square bandage on it for sympathy. Conman.",tg0cwGMvMLM
@lisakrueger1764,6,So much for transparency!,tg0cwGMvMLM
@enki4589,6,Get them Trump!!!!,tg0cwGMvMLM
@poppeteja6433,3,That is absolutely his perogative.,tg0cwGMvMLM
@melodymusik261,3,"FAKE attempt!!  And exactly why he will ""keep it to himself.""  Evil abounds with this one.",tg0cwGMvMLM
@julielemaux795,3,What are they asking?,tg0cwGMvMLM
@elrando5981,3,Disclaimer: “No ears were harmed in the staging of this event.”,tg0cwGMvMLM
