comment_author,comment_likes,comment_text,video_id
@tyffen123,2,Blacks do so much violence against White folks,5X5V59MHXNk
@JohnDoe-ew5sf,2,Never relax,5X5V59MHXNk
@olega.kondratyuk2130,1,Kilometers?😂,5X5V59MHXNk
@Choppaslit666,1,🥷 be doing too much fuccccccc em,5X5V59MHXNk
@AndreasGlasauer,1,Einverstanden zu 100 %,5X5V59MHXNk
@irmamendoza9905,1,"Vulgarly Gross murder. Diabolical, no remorse from the young man. How was he raised to become this monster? Yes life in prison.",5X5V59MHXNk
@PERUANO31,1,deport back to A,5X5V59MHXNk
@Boyleheights213por-vida,0,GOOD DECISION,5X5V59MHXNk
@James-yl6jj,0,Totally agree!!,5X5V59MHXNk
@BUNZALOT,0,This is bullshit! Stop adding stories together for your own benefit! He killed another boy not some 70 year old. Do your research,5X5V59MHXNk
@MikeMorales-n4m,0,The no remorse is the biggest part for me  life it is I agree,5X5V59MHXNk
@kumarsaurabh2461,0,Demon 👿,5X5V59MHXNk
@evelynsaba5022,0,"I agree with the judge. These kids,  They  have no respect for life anyone s life . Yes judge life. That boy says he loves his family. Weii dosent he think that  thos people also love  there 73yr old grandmother.  It works both ways  .",5X5V59MHXNk
@dennismichaels70,0,Sub 80 IQ race and culture. The family should be in jail as well. They raised these monsters.,5X5V59MHXNk
@scottkendall6587,0,what happened to the other teens?  Did they plea out or did they get life too?,5X5V59MHXNk
@mantlecollector,0,Black people want others to respect them and not look down on them like they are so criminal or up to no good or uneducated or they are less then but how can u respect someone when they act like this and have no respect for others and want to play the race card that black lives matters,5X5V59MHXNk
@Krulfar,0,Someone willing to end another person's life for no reason and then laugh about it shouldn't be allowed to live.,5X5V59MHXNk
@ScottMurraycrotchetyoldbastard,0,rope,5X5V59MHXNk
@tammybushnell6920,0,All 3 were involved in the crime and all 3 should be sentenced the same.,5X5V59MHXNk
@riverbluesky,0,💯 agree with the judge,5X5V59MHXNk
@lesliejones873,1,This is sad... someone she knew got her that job it's now way that woman had an interview panel. Ridiculous,M5o6Nq6jEdA
@haulolo6816,0,She should go work for FOX so she can make stuff up and they would all agree with her 😂,M5o6Nq6jEdA
@RaielGaming,0,What a moron,M5o6Nq6jEdA
@GO-xs8pj,0,This female host is another bimbo that should have have TV time.,M5o6Nq6jEdA
@gerry4915,0,A result of all those chemicals in the american cereals 😅😅😅,M5o6Nq6jEdA
@ADSNavarro,0,"Americans pride themselves waving the constitution around, but they don't know what it actually says",M5o6Nq6jEdA
@CaptchaNeon,0,"There’s a reason why she’s a Senator and they’re a news anchor. 2 different worlds, 2 different intelligence levels.",M5o6Nq6jEdA
@MossTunic,0,Separation of power is vital for democracy.,M5o6Nq6jEdA
@ejonbul,0,"Trump followers Trump included think president is like a King, good luck USA",M5o6Nq6jEdA
@briandfallon74,0,"Yea.  Let Teleprompter Barbie argue the law with a Harvard law professor…

Smdh…",M5o6Nq6jEdA
@bikingmomma524,0,I would have loved to have Senator Warren as my professor in college.,M5o6Nq6jEdA
@doejam,0,Fire her right now,M5o6Nq6jEdA
@joefarang,0,I'm so angry at Warren for insisting on talking facts over the SUPER PRETTY hostess when she tried to interrupt /s,M5o6Nq6jEdA
@janetbrock-hughes4720,0,"WHAT EMERGENCY...
WHERE ARE OUR COURTS
   NOW!!!",M5o6Nq6jEdA
@maddogmattis1775,0,She is the dumbest anchorwoman on CNBC. 😂,M5o6Nq6jEdA
@janetbrock-hughes4720,0,How did these newscaster get their jobs...?????,M5o6Nq6jEdA
@janetbrock-hughes4720,0,LISTEN & LEARN CHILDREN!!,M5o6Nq6jEdA
@Musicmann41,0,"The ignorance displayed is why propaganda exist,  it's like placing a loaded gun in the hands of someone who doesn't have a clue how that weapon works.",M5o6Nq6jEdA
@Kttires,0,Why don’t they teach Civics in school like my husband and I? We know the constitution!! We know it said Treason in our Constitution. Now it does not! He acted on Treason!,M5o6Nq6jEdA
@rizingpho3nix,0,The 3 branches of U.S government conducts checks and balances on each other that way no branch has complete power and authority.,M5o6Nq6jEdA
@neilmartin99,1,"Does this pathetic channel ever talk about anything besides Trump?🤣😅😆😂😁
I thought it was a news channel. 
Guess not.",oZCEKb3NNJ0
@neilmartin99,1,"LOL For 3 weeks the democrats have been crying and telling President Trump to back off his demands. Then when he does, the leftist media calls him a coward. 🤣😂😅😆
No wonder nobody watches MSNBC and CNN.",oZCEKb3NNJ0
@AmazeJourneys,1,"Trump’s a clueless leader, making snap decisions based on his own whims, screwing over the economy and American businesses.",oZCEKb3NNJ0
@garybou8559,1,"Flipflops made in California for $60 is BEAUTIFULL , BEAUTIFULL , just BEAUTIFULL future of America?",oZCEKb3NNJ0
@JackDespero,1,"Literally like a child throwing a tantrum at the supermarket.
Crying, yelling, rolling on the floor. You are just looking at them.
Crying more, yelling more. You are just looking at them.
They stand up, clean their nose with their tiny shirt.
""Are you done?"" And they nod.
And you continue your day.
The same child will be laughing in two minutes, even if the eyes are still red and the nose is still running.
Now children do this because they do not understand concepts like boundaries yet.
They don't do it out of malice, they literally don't know better (yet).
You wait until they get tired, and then you teach them why what they did was wrong.

What we are seeing is adults in other countries waiting for Donald to get tired.
And now that he got tired and is listening, now it is time to actually teach him and negotiate.

Why is the President of the US a manchild? That I don't know, y'all who voted for him will have to figure that out.",oZCEKb3NNJ0
@FredJones-lo2df,1,"Is this a Great cuntry , or What ?",oZCEKb3NNJ0
@FPSDAVE23,1,IMPEACH TRUMP = SAVE WHATS LEFT OF AMERICA!,oZCEKb3NNJ0
@LatifahHjtuah-m7u,0,Is that the reason why you let man play woman sport? Is that why your candidate is kamala harris? Sick msnbc reporters,oZCEKb3NNJ0
@LatifahHjtuah-m7u,0,This man look like pain. Nothing you say will change my love for Trump,oZCEKb3NNJ0
@edwardlee8343,0,Trump is a POS...a waste of a human being..can you even call him human ?,oZCEKb3NNJ0
@Rastathagv3,0,It’s insane that democrats can’t accept anything their party does. All they care about is being against anything the American people want lol.. insane,oZCEKb3NNJ0
@jessicareid8358,0,We love ❤ you Lawrence,oZCEKb3NNJ0
@valeriem3610,0,"😅😅🤣🤣🤣😂😂😂 i hope this is not true representation of white nationalist strong man🤣🤣🤣.. i mean where is common sense anymore?? Yet republicans wont even stop him even when his answer to 1x3 is 4, somewhat republicans will try make 4 be the right answer.",oZCEKb3NNJ0
@RichardCohen-v7y,0,"Lawrence might be right—Trump talks about never backing down, but the reality is different. When it comes to real action, does he ever follow through? And what about those Trump Tariffs that are still hurting American businesses?",oZCEKb3NNJ0
@NetWit20,0,"Larry must not recall Nixon's firings. Trump makes deals, that's what he's always done. People get uptight because you don't play with their money and he backs off. So what if he didn't Larry? You'd be saying Trump never admits he was wrong even if it means driving the economy in the ground. I'm getting the feeling no matter what Trump does, Larry will disagree with it. Now go ahead and shadow ban me again if you want.",oZCEKb3NNJ0
@bryanweston6779,0,Searching prison for the next candidate for the next election,oZCEKb3NNJ0
@victorialn63,0,He doesn’t know wtaf he is talking about!!,oZCEKb3NNJ0
@testos2701,0,"Looks like Donald finally found her true mate, they were made for each other, HEY!",oZCEKb3NNJ0
@mssallyk3447,0,"They dont care about the economic losses bcuz they will walk away with the criminal crypto money, and the rest of will be left holding the bag.  He could have done nothing and we all would have continued with our lives and things would have continued to improve BUT no, he took Putins advice to pick this fight so that Putin and XiJinping would like superior to djt and USA.  He consciously chose to ruin our position in the world.  He is really looking more and more like Putins puppet.  Is it 100 days?",oZCEKb3NNJ0
@lastoriasiamonoi7662,0,Trump is a loser. Good luck USA,oZCEKb3NNJ0
@johnadey3696,1,"Can he be surprised? The cyber truck is the ugliest vehicle ever produced! I assume Musk must have intervened in the design process, as no professional would have dreamed of that awful thing! Are the people protesting in Europe receiving American Social Security?",sg_uNrJ0sks
@JeffRL1956,1,"So the same guy who bribed people to vote for his preferred candidates in primaries, federal elections, and state elections is whining that the protesters are being paid? LMAOROTF.",sg_uNrJ0sks
@stuartgraca,1,"Like Trump , Musk assumes everyone acts as they act , everyones motives are like their motives , so if Musk buys crowds and votes , the opposition must be buying more opposition , but wako he realizes this must be costing a fortune , so he us baffled wanting ti know whose paying them ? Surely its impossible to demonstrate freely ?",sg_uNrJ0sks
@JeffRL1956,1,"Elmo has a cult just like tRump does. Have a look at the comments for videos right here on YouTube showing yet another SpaceX rocket blowing up. Because he's building and launching rockets, to his cult that means he can do *no* wrong. They absolutely lose their sh*t over little things like calling him Elmo. I was booted off an aviation-themed website for doing that. Not for also suggesting that he's a Russian asset. Just for calling him Elmo. There's no question that far more people hate him than worship him, but keep in mind that he has his own cult and they will let him do *anything* he wants as long as he keeps saying he'll send a spaceship to Mars.",sg_uNrJ0sks
@JeffRL1956,1,Why do people take an instant dislike to Elmo? Because it saves time.,sg_uNrJ0sks
@AlteredImages,1,Musk is so out of touch! The creepy ketamine addict just is a plain ole asshole.,sg_uNrJ0sks
@jimsmith556,1,The worlds richest assh@le. What an ignorant idiot. It would cost billions to pay all these protesters. I didn't realize Musk was that stupid. 100% narcissist.,sg_uNrJ0sks
@calicoe99,1,Everything malignant narcissists accuse of others is projection. E-dolph is the very definition of a covert narcissist.,sg_uNrJ0sks
@roundtwo3321,1,I'm looking for more protest footage on youtube.,sg_uNrJ0sks
@jutarzo,1,Like the money you paid people to vote your way?,sg_uNrJ0sks
@NicoleMakki,1,SHES RIGHT,sg_uNrJ0sks
@xAnneKHx,1,"I think it is not only the numbers of people out there protesting, its those SIGNS, what they say about Trump, and to Trump. aAnd the signs about Musk too! Those signs are awesome, and so creative!",sg_uNrJ0sks
@linhunter3123,1,"Yes. I’m mad! I want my way of life to NOT be sacrificed to the greedy far right: Trump, Musk, Vance, GOP, DOGE—GO AWAY!",sg_uNrJ0sks
@SiyaMiti_the1st,1,"Oh please! Who would pay 10s of 1000s of people in multiple cities to protest? 🙄
Elon can't even admit his tenure ""in government"" has been a disaster as expected by anyone with any sense",sg_uNrJ0sks
@jeanjohnson-yy8zs,1,If you don’t understand the goals of DOGE  and you rejoice about violent protests against a fellow American innovator then you deserve a Rachel Maddow and your karma which is guaranteed.,sg_uNrJ0sks
@haulolo6816,1,I want to see a headline “Tesla filing for bankruptcy”,sg_uNrJ0sks
@ToritoMedia,1,"Bankrupting his companies, watching him lose his wealth, total public humiliation is nowhere near punishment enough. #MuskForPrison",sg_uNrJ0sks
@Swannying-Around,0,That woman is creepy how did she get on TV?,sg_uNrJ0sks
@kevin-u7s2y,0,NOT  ENOUGH!!,sg_uNrJ0sks
@karamichael2577,0,"NO A$$HOLE! We are not people GETTING PAID, We are people WHO PAID! Trump and Musk were made for one another. They don’t make anything, they steal it from others and ruin it wasting other peoples money all the way.",sg_uNrJ0sks
@MrGene3630,1,"I really don’t feel sorry for her the least bit. I’ve seen to many families torn apart and financially devastated when factory jobs started leaving America to China and other countries. Needs to change, and sooner rather than later.",ZXG9o8Vj4tw
@MR.G-N2IT,1,"Don't make you products in 
Communist countries 😂",ZXG9o8Vj4tw
@dawong8844,0,"Guess what happened ？ tariffs concessions already given to China without a word from China. 
Losers",ZXG9o8Vj4tw
@steveo7883,0,GOOD!!! AMERICA FIRST!!! 🇺🇸,ZXG9o8Vj4tw
@ValerieIVanorden,0,Hard.,ZXG9o8Vj4tw
@RalphBennett-mi2hs,0,Should have made your product here.,ZXG9o8Vj4tw
@zombiehunter7414,0,Not sure people want their children eating off a product made in china anyway. They aren’t the best at quality control are caring if it gives you cancer.,ZXG9o8Vj4tw
@didyouknow...2263,0,Imagine that! You lose in China tariff or no tariff.,ZXG9o8Vj4tw
@mushv9892,0,"Must be those  rah rah trump supporters. Sure, made in America, pay higher labor costs, pay for sick /vacation days, holiday pay, and deal with union. THAT will lower the cost to consumers? Do the math.",ZXG9o8Vj4tw
@ahill6858,0,Build in America,ZXG9o8Vj4tw
@prosunsport1,0,Ship the moulds over and manufacturer in Mexico or USA and if u have to drop your margin,ZXG9o8Vj4tw
@kathyyocum1448,0,"Then you shouldn’t have made a deal with China , you went there to have your product made by child slave labor , I hope you do lose everything .",ZXG9o8Vj4tw
@boneculinator,0,shouldn't have taken the mfg to China,ZXG9o8Vj4tw
@kirstenmartin2650,0,Chinese did that with Italian shoes.  Moved to Italy and worked learning how to make Italian leather shoes.When done they immediately opened their own shoe production shops and now sell Italian shoes that are not made by Italians,ZXG9o8Vj4tw
@gloriarichard991,0,Mr Wonderful always suggest to entrepreneurs to manufacture in China. I wonder what has changed his mind or does he still do all his manufacturing in China?,ZXG9o8Vj4tw
@Trash432,0,so nice of her to use child slaves to make stuff for babies. If you don't like it then bring your shop to the US and stop using slaves you pay pennies.,ZXG9o8Vj4tw
@newfront6786,0,"I’ll say it one and only once “MADE IN AMERICA”, never sounded better. “MADE IN AMERICA” Trump 2028",ZXG9o8Vj4tw
@ccya157,0,MADE IN USA 🇺🇸,ZXG9o8Vj4tw
@isitmee501,0,He just totally ignored the question.,ZXG9o8Vj4tw
@youtube8775,0,We should collectivize all chinese purchased land in the u s a for Americans.,ZXG9o8Vj4tw
@lasvegaskenoslots470,2,Everyone is a good person until you get caught..life catches up and now it's time to pay up..,HtwLF1PbB4g
@dontewilliams1204,2,"Stephen A. Smith is basically saying, ""i can't help you, brother, on this one. We are black, we can't take them down by ourselves!!!",HtwLF1PbB4g
@eastbee103,1,This is bull jive!!,HtwLF1PbB4g
@tarawright8152,1,"Stephen A. much respect to you sir for articulating Unc situation with clarity and integrity.
☮️➕💟",HtwLF1PbB4g
@RadicalRickEntertainment,1,"Unc was schooled and made a fool of by a gold digger lol, it's time to replace him with SSSSKIIIIUUUUUPPP!!!!!!!",HtwLF1PbB4g
@timtresch4848,1,"A lot of people have no problem telling men they shouldn't go after young women, but no one telling women not to go after rich men.",HtwLF1PbB4g
@ChrissyVelvet429,1,"It's not a good look. Her age, she is like 1 year out of high school. A minor, basically. She is not  even legal drinking age. He had no business talking to her. She is younger than all of his grown children.",HtwLF1PbB4g
@Joe-o2v9t,1,I wouldn't want Stephen A. Smith as a friend.🤦🏿‍♂️,HtwLF1PbB4g
@DawudMuhammad-t2v,1,Stephen A Smith..... you're terrible friend,HtwLF1PbB4g
@Eric-n2o2s,1,"I Believe Unc is being set up, I Love You Unc, I know you wouldn't sexually assault anyone,  that is not Who you are",HtwLF1PbB4g
@CLEVELANDMIKE-ws9he,1,What about Justin Tucker 🤔🤔🤔,HtwLF1PbB4g
@Dundotti,0,"I’m in tears right now man. I’m very disappointed man, I’m sad that this may ruin your reputation 😭😭. I feel sorry for Ocho 😮",HtwLF1PbB4g
@TheDEWROCK,0,Half of a New deal seems fake. Just saying,HtwLF1PbB4g
@DerricoSwitzer,0,It's more behind this than meets  the eye since the interview with  kat Williams he been target allegedly think about it.i hope he will be ok Williams said that they going to come at him. My prayers are with you,HtwLF1PbB4g
@lovsply,0,CUT THE BS SHAY…. YOU F’D UP 😂😂,HtwLF1PbB4g
@nathanielemmons1924,0,If she is awarded that money it will change the world and the way we interact,HtwLF1PbB4g
@joemiller1717,0,maybe his boyfriend lebron will bail him out,HtwLF1PbB4g
@joemiller1717,0,lakers in five lol,HtwLF1PbB4g
@Janessa_music,0,These young women always looking for payday,HtwLF1PbB4g
@TheDEWROCK,0,"Why 13 pages, why not 12 🤔",HtwLF1PbB4g
@DavidIAM99,1,Dilly Dali...,uKyDCijwm9g
@FreyaVanBuren-go8qn,1,Poor woman she just wanted to visit France.,uKyDCijwm9g
@rm-hb6ul,1,Man last time i flew i carried my clothes on a hanger walked thru the airport nude. Got arrested. Told the judge no use dressing twice  he dropped the charges and gave me his number,uKyDCijwm9g
@1914AD,1,"Wow, well that’s scary!",uKyDCijwm9g
@Madelena714,0,My mother always said she could get away with anything because of how invisible she became to society as an older woman. It was heart break as well as a super power.,uKyDCijwm9g
@Dr.SimpleBudgets,0,Well hellooo Dolly.,uKyDCijwm9g
@giiggii11,0,She's either really smart or we are too stupid 😂,uKyDCijwm9g
@allykatt1849,0,Incompetence at its finest. Still proves how unsafe with the lack of security airports are.,uKyDCijwm9g
@matrixglitch4664,0,Right. Propaganda.,uKyDCijwm9g
@rachelortiz4843,0,WTF!!!,uKyDCijwm9g
@prakashholla7331,0,"No system is perfect. As long as these incidents are rare .....
What would be worrying is is la mic terr or ists copying her and blowing up that plane",uKyDCijwm9g
@mwfmtnman,0,"And this is what unchecked ""consumerism"" has gotten us. The morals, no values, no principles. Just gimme gimme gimme.",uKyDCijwm9g
@cygnus62,0,DEI in practice.,uKyDCijwm9g
@WonderWoman829,0,I’m glad I don’t fly,uKyDCijwm9g
@billburchett3429,0,"Give her 20 years in prison, no parole!!",uKyDCijwm9g
@NoName-hu8ju,0,"her blonde hair and blue eyes was her🤨 boarding pass…. If this woman was of melanin complexion, she would’ve never made it past security.",uKyDCijwm9g
@WickerDuck,0,"I say change the rules that if you make it onto the plane, you have to be accepted at your destination.",uKyDCijwm9g
@LeydenAigg,0,Knowing how to blend in.,uKyDCijwm9g
@DAMNright_SUNlight,0,Hmmm maybe have better security lol,uKyDCijwm9g
@bondslave100,0,You do the crime you do the time,uKyDCijwm9g
@robertgavin980,2,What came first? The chicken in the white house or the egg on his face?,0y7hSzUYlJM
@seethingsclearlyawaken3424,1,"Those poor Easter Bunnies are so depressed because of tRUMP's Dictatorship!   tRUMP has made it illegal for the Easter Bunny to be worshipped, because he wants the children to worship the tRUMP-Statue!     tRUMP has really made our lives so wonderful now.  Everybody is celebrating!   NOT!   Where is the ""MAKE AMERICA GREAT AGAIN"" thing?  America is going downhill fast!  The economy is in the toilet, you are cutting all of our necessary programs to keep our seniors safe and healthy.    Drag tRUMP and MAGAts out of the White House!",0y7hSzUYlJM
@alphared8028,1,That line was gold 12:03 🍁,0y7hSzUYlJM
@window3640,1,This guy is obsessed with Trump. He would not even have a show if it was based off of his own jokes and humor. Such a loser!,0y7hSzUYlJM
@Gameress84,1,I think Canadians and Americans forget that the blood sweat and tears are originally indigenous people/Natives.  I support Canadian’s outrage as a frustrated American.  Who never wanted trump ever!! Uk and Canada are getting so mad about 51 state.  It would never happen lol  The suggestion is as ridiculous as Trump.  It’s just trump talking out of his A double S again. 😂😂😂.  It’s like when Iraq thought we wanted there country back in early 2000’s.  We didn’t!! 😂😂,0y7hSzUYlJM
@peters-z8n,1,"Wait, Fox News has a Spanish language channel too? I thought that was woke too, since English is the official language now.",0y7hSzUYlJM
@ondrejkratochvil4589,1,btw i've bought 30 eggs for ~$4.5 yesterday... no eggless Easter in Europe :),0y7hSzUYlJM
@user-vs9fz8vy1k,1,Can someone show a video of the Trumper winning All the golf tournaments he “wins” at his own golf course🤪,0y7hSzUYlJM
@MsMarple,1,"Not supporting Trump’s effect on eggs, etc but sorry folks - rabbits and eggs were associated with ancient pagan fertility rites. Nothing to do with Christ and his resurrection.",0y7hSzUYlJM
@essiebessie661,1,The Oval Office is hideous! And The Ivy is gone!,0y7hSzUYlJM
@ashscott6068,1,"God, the Oval Office looks so gaudy and tasteless. It looks like a Dubai hotel room, or Putin's bathroom. Why does every single dictator lose all sense of style, and just cover everything in tacky gold leaf? And everything has to have a ton of carved or molded detail! TOO MUCH DETAIL. It's like your eyeballs are getting bent over the seat in a Macy's changing room, and a mushroom - or possibly a finger - is having its way with them.",0y7hSzUYlJM
@Jelisa-b8y,1,"Elon, Jeff , and Trump need to go to that new planet also that that losing administration fron Vance to all Pete , Pam Bondi etc…",0y7hSzUYlJM
@petersanches9912,0,"As an American 
Go Canada 🇨🇦",0y7hSzUYlJM
@frstygrl3518,0,Sitting with Trump is his Clown Car!,0y7hSzUYlJM
@sylviaw7284,0,Omg yes Elon go to freaking different planet!!!!!!,0y7hSzUYlJM
@lucyloojones2779,0,"The country finances are crashing…what does trump do? He rushes too redecorate everything in 
‘Gaudy Gold’… yuk!",0y7hSzUYlJM
@chautiendung,0,"20 millions=20,000,0000.00?",0y7hSzUYlJM
@towerjunkie19,0,Our country is going to hell in a golf cart but Jimmy Kimmel keeps us laughing anyways. Good comedy relief. We love you Jimmy,0y7hSzUYlJM
@yeahletsunpackthat,0,We call it the buck 25.. hasn’t been dollar store in a bit 😂,0y7hSzUYlJM
@jeannievrantsis445,0,Squirt stick? Jimmy enough with the technical jargon.,0y7hSzUYlJM
@AnnWales,4,"I think one of the biggest misconceptions is that Trump's tariffs only affect big businesses. It's not that simple—these tariffs can trickle down to everyday consumers, impacting the prices of goods we buy regularly. I made the mistake of assuming tariffs were just a ""big business problem"" until I noticed my grocery bill creeping up.",5zQ0WewZY50
@advocacyandaccountability,2,The people calling Trump a genius will never live that down. Ever.,5zQ0WewZY50
@davidofergals6947,2,Democrat. Cry more.,5zQ0WewZY50
@prettypic444,1,I trust the muppets’ competency way more than I trust anyone in this administration’s,5zQ0WewZY50
@user-om3bc6iy2c,1,DT is so stupid how could anyone vote for him except the stupid spineless traitor bought Republicans.,5zQ0WewZY50
@mogmigyt,1,"Don’t worry after four years, America will elect a Democrat and then blame them for the aftermath.",5zQ0WewZY50
@youtubecommentsthetaintofh7042,1,Dude turned 48 today. Looks like he's 58.,5zQ0WewZY50
@davidsullivan7743,1,"With the state of the mess on top of Trump's head, I'd say he's running a deficit  with his barber as well",5zQ0WewZY50
@jordanadkins2427,1,This didn't include the segment on the fish doorbell,5zQ0WewZY50
@georgejesson1944,1,Xi isn't calling🤣😂🤣😂🤣,5zQ0WewZY50
@hakank.560,1,countries are getting fed up with the US and Trump except israel.,5zQ0WewZY50
@aliasif8498,1,Mad King is even more mad than anybody thought..he keeps on proving it every day,5zQ0WewZY50
@tejasnair3399,1,I agree with the points but its not funny enough. Put more funny next time.,5zQ0WewZY50
@qaribullahshariffbaita6734,1,"Amazing video, you work for 40 years to have $1 million in retirement while some people are investing just $10 thousand in trading just few months ago and now they are multi millionaire..",5zQ0WewZY50
@quid3846,1,"Ugh how does anyone watch this? Low brow jokes written by depressed liberals, only to be read by an DEI hire that hates the country that took him in.",5zQ0WewZY50
@MrRay168,1,april 23 he blinked again.,5zQ0WewZY50
@Greyblockpuppy,1,"Trumpian and MAGA treachery is at it's finest worst, for all to see. I'm so sorry 4 blind MAGAtism. The Cult of MAGAtology must be defeated.",5zQ0WewZY50
@ReQuiem_2099,1,"Lol, ""Boomers have KILLED the diamond industry!""
😂🤣😂",5zQ0WewZY50
@wj6938,1,Stop Trump this evil man.🤮🤮🤮,5zQ0WewZY50
@MrIzzy4real,1,and Cramer told us to vote for this guy....,5zQ0WewZY50
@tammybarnes22wwwwe2w7,1,China should dump our bonds debt back in to the system and then stop selling goods to us and stop making goods for us now ASAP that is what i would do if it were me,PFNTHObSSKE
@patriciaknight1332,1,This is hilarious,PFNTHObSSKE
@tammybarnes22wwwwe2w7,1,Pam Bondi and Kash Patel look this mess up now ASAP truly Lord rev dyjuan d Barnes Yahweh PhD Esq MD,PFNTHObSSKE
@angierox6964,1,Two idiots in charge. As a US born citizen I’m embarrassed and am not represented by the current government,PFNTHObSSKE
@qaribullahshariffbaita6734,1,"Amazing video, you work for 40 years to have $1 million in retirement while some people are investing just $10 thousand in trading just few months ago and now they are multi millionaire..",PFNTHObSSKE
@earnestmckinney236,1,"CHINA,🇨🇳 I APOLOGIZE FOR THE IGNORANCE OF OUR AMERICAN 🇺🇸 LEADERS; ALL OF US AMERICAN 🇺🇸 DON’T VIEW YOU AS PEASANTS!!😮",PFNTHObSSKE
