comment_author,comment_likes,comment_text,video_id
@trs1harlemnyc390,0,It’s funny these people will say they’re willing to take the financial hit for tRump realizing tRump would never take a hit for them… not even if their lives depended on it🤣🤣🤣,Wsn1baT3WaU
@gerry4915,0,If i had the power to hand out even average intelligence....these are the people i hold responsible for landing us in this shit... I have no sympathy for them...,Wsn1baT3WaU
@AndyH-y2y,0,Wake me up when it‘s all over 😅,Wsn1baT3WaU
@KyleFrancome,0,Wow  a CNN low,Wsn1baT3WaU
@petruSarac,0,It's a cult ffs! Nobody wants to admit they were wrong . Such is life,Wsn1baT3WaU
@MrsUnderwriter,0,"""Feeding the world""?  What paralell Universe are you living in? You can take your chemical products and ,...... keep it. World does not need your overpriced, genegically modified things",Wsn1baT3WaU
@bobsacamano7653,0,It's called brainwashed by propaganda and lies.,Wsn1baT3WaU
@gigiobrzile6228,0,Trump hates People USA,Wsn1baT3WaU
@allyfire7915,2,"America  you  deserve  what Trump  do 
Because  you  couldn't  handle  a black Indian woman  she is intelligent  .",HJOrapS3IVg
@bobdinitto,1,We know that Elon is intimately familiar with propaganda since he dispenses it on Twitter and in the news media daily. This con artist can fool some of the people some of the time but not all of the people at any time. We're on to him.,HJOrapS3IVg
@user6tos8ca,1,"We couldda had a very well qualified, smart, capable woman in the WH.....instead we put a 34X felon & self-serving traitor back in, and he brought along a nutcase w a chainsaw to hack his way through our Social Security and steal our info while driving up the deficit. Nice going magats lol!...........BTW, when will we see those 'cheaper groceries' ? 😂🤑",HJOrapS3IVg
@kynmindi,1,Yep! Its me...the viscous LEFT!  COME AT ME BRO!,HJOrapS3IVg
@pamelabarsh4407,1,"Hi Rachel, I think that's fake that he's trying to quit I think that he had to get out there and put that out to the people of American but I think all that Elon and Trump doing is faking you all out😮 shop is a liar and so is Elon musk🎉",HJOrapS3IVg
@CJGoodman-g6z,1,"Take his Trolls with him leave our private information alone. He didn't clean up any corruption, he got into everybody's information for his AI project, mark my word, he didn't find nothing. It was all just to help his AI not for our country.",HJOrapS3IVg
@EugeneRay-l2r,1,"Dont know what man is uglier to look at. Both equally as ugly on the inside. What about trumpys money people, and the ones pushing trumpy boo boo lies and propaganda are included im sure!!!! Its a two way street. He definetly hasnt any good people.",HJOrapS3IVg
@user6tos8ca,1,"DOGE = Dirty Oligarchs Grabbing Everything..............President Muskrat needs to be DEPORTED & his clueless old orange clown puppet need to be LOCKED UP. 

Only then can we make America great again!............The huge worldwide Tesler BOYCOTT is working like a charm! 

Sales are way down, the stock is headed to sub $200 before yrs end. Nobody wants him around, even f45 is getting tired of Muskrat.🤑🤑🤑🤑🤡☠👿😡💔",HJOrapS3IVg
@ej2953,1,Most transparent administration in history?  Is she on crack?,HJOrapS3IVg
@MarlienCripps,1,It was quite interesting to see musk and hegseth skipping around the pentagon like a couple of teenyboppers.  😂,HJOrapS3IVg
@Medellin1823,1,You guys should have voted for Kamala Harris. Trump's making America great again. He's doing a real bang up job. Pat yourselves on the back MAGA'S. 😂,HJOrapS3IVg
@FrederickZmarlak,1,You can't be anything more than Apparent when you're constantly F'cking everything up all the time.  This American Government is a Bunch of Morons!!!!,HJOrapS3IVg
@EstellaGarcia-yu4mq,1,Look in the mirror elon,HJOrapS3IVg
@adamgrant8372,1,ELON IS PATHETIC......I SAID THAT ELON. ARE YOU BUTT HURT NOW!!!!! TOUGH SHIT ASSWHIPE.,HJOrapS3IVg
@112313,1,How dafaq does supreme court judges became a popularity contest??!!! Shouldn't the best judge with the most seniority gets the job??? No wonder american judiciary system is so corrupted and fucked up.,HJOrapS3IVg
@Stevechodhu,1,"Whoever voted for Trump voted for Musk and now they seem to be worried about the consequences. 
Too late and listen to all those idiots who still support Trump! They lie and think normal people will believe whatever they spew out! Musk deserves what he gets and time for him to move on and start counting how many kids he has out there and how much he will have to pay all of them including the women!",HJOrapS3IVg
@christinewhite6879,1,What a GD joke Hegseth is. This is so embarrassing for America.,HJOrapS3IVg
@beemail8785,1,"""boys will be boys""?!?! How toxic! Stupid boomer. She is sooooo old and plastic! Ewww.",HJOrapS3IVg
@ZeroSpawn,0,Cringe 9:37 ,HJOrapS3IVg
@ame7933,0,Now they are making doge state offices,HJOrapS3IVg
@4CQueen,2,"Ava was never legally adopted by diddy, Ava Baroni's parents were best friends with diddy's late wife Kim Porter and Ava was friends with diddys daughters; as creepy as seems, The video was  sort of a skit and wasn't meant to be taken seriously, Ava's mother told Diddy it was okay to make the video. Ava is living a private life now.",LzFXAVsDMCU
@AimeeCurry-i9o,2,Avas parents should go to prison too.,LzFXAVsDMCU
@elizabethdesousa8290,2,"Terrence is a conspiracy theorist. Being gay isn’t the issue here, it’s about abuse. Diddy abuses people regardless of gender. Do not conflate homosexuality with abuse.",LzFXAVsDMCU
@mrsmsguillory4356,2,No good intentions. Everyone in the background should be questioned. Nothing positive,LzFXAVsDMCU
@reneelanry7528,2,When Ava said she's a Scorpio that told it all she's being sold 😢,LzFXAVsDMCU
@anitarose7915,1,"At least 1,000 people knew the truth!!!",LzFXAVsDMCU
@ShannonFranklin-e7j,1,Sold  that poor baby girl,LzFXAVsDMCU
@Skyeyez99,1,"That poor girl.  The way those ped0s are staring while surrounding her, makes my skin crawl.",LzFXAVsDMCU
@kathyvargyas1453,1,Everyone knew what was going on a did nothing. Absolutely vile disgusting people. Everybody’s brave now that he’s in jail. Cowards!,LzFXAVsDMCU
@Martito-q1g,1,"Shes definitely reading dialogue n he Trying to Fixate sht. A black man adopting a ""white child"" he was so dam fixated on that",LzFXAVsDMCU
@kdgalaxy5379,1,His daughters are in the background as well but just the sons,LzFXAVsDMCU
@AngelLuisEspada1970,1,That isn't Diddy 0:55,LzFXAVsDMCU
@cjhoward3116,1,I'm sure that girl was bullied by  diddys daughters and abused by his sons as well as much as they all mention race I'm sure they did a lot of stuff to that child just because she was white,LzFXAVsDMCU
@laurascarpatte-bell2134,1,His days are coming.,LzFXAVsDMCU
@Sweet-Pea-s8r,1,Where is Ava now??,LzFXAVsDMCU
@supachadtv,1,He showed her for buyers,LzFXAVsDMCU
@lauren.b92,1,That poor girl. 😢,LzFXAVsDMCU
@americanfreedom6417,1,Sick,LzFXAVsDMCU
@SaskiaTheBoss,1,she definitely looks high as if the sedative was slowly kicking in,LzFXAVsDMCU
@SaskiaTheBoss,1,"i’m puzzled about how she can be “a little homeless girl” at her age, within her race, in america, without anybody growing concerns or authorities being called… definitely sound like a traff!k!ng victim storyline… then he made sure to mention her parents last minute to reinforce his storyline in case there were still doubters… 

to regular viewers it just sounds like she’s the twins friends from the same neighborhood that’s why she was outside, but when you uncover all these information about that demon, there’s nothing normal about that little girl being on online, without the twins being front & center next to her.. four grown ass men with her in the frame, & only when they’re done you can see a peak of the twins… that’s not normal at all… if she was really the twins bff, they would have also tried to introduce her & being all giggly toward their friend, not be hidden away as if a product is being sold but his daughters not included! “@trublgrl: How disgusting.  He mentioned Ava's and his own race ten times, but never mentioned the word ""love"" once.  That is not a real adoption, it's not affection, it's a purchase of a human being.  That man has no soul.”",LzFXAVsDMCU
@Cielolindoo,3,"Santo padre Francisco en paz descanse, gracias por dejarnos grandes frutos en la puerta santa ojala y todas las personas puedan recibir tan grande regalo, lo quiero mucho y por siempre 🙏🙏",pq4DrEkF1sI
@CarmenCaballero-c1w,2,"Gracias Dios Padre Celestial y Todo Poderoso nos diste un Papa Latinoamericano y que con La Santisima Trinidad y Nuestra Querida Mamita LA VIRGEN MARIA NOS DEJO EL LEGADO DEL SERVICIO Y APOYARNOS TODA La HUMANIDAD EN  Dsr, Comprender, Ayudar y Servir en El AMOR, HUMILDAD Y SENCILLEZ, EN ESTOS 12 AÑOS DE SU PAPADO. BENDICIONES. ALELUYA, ALELUYA, ALELUYA.AMEN❤😇🙏🙏🙏🙏🙏🙏🙏🙏🇨🇷💕",pq4DrEkF1sI
@CarmenCaballero-c1w,2,"DESCANSE EN PAZ, QUERIDO PAPA FRANCISCO, Y BRILLE PSRA EL LA LUZ PERPETUA. BENDICUONES EN SOLIDARIDAD Y ORANDO DESDE COSTA RICA💕🇨🇷😇🙏",pq4DrEkF1sI
@eliamejia9222,1,Ese ataud esde un mazon verdadero 😮😮😮😮Dios tenga misericordia lean la Biblia conoceras la verdad y la verdad los hara libres,pq4DrEkF1sI
@federicorodriguez3548,1,Que Díos lo tenga en su Santa gloria al Papa Francisco QDEP.,pq4DrEkF1sI
@MariaDelCarmenReyesRodri-cd4ur,1,Gracias por trasmisión en vivo 😢,pq4DrEkF1sI
@teresapita1952,1,❤,pq4DrEkF1sI
@claraluna4637,1,"No se ve una sola mujer en estos ritos, como si no existieran la mujeres. Nos ignoran por completo. Como si todos esos curas no tuvieran madre o hermanas, no hubiesen llegado al mundo a través de una mujer que les dió la vida. Religión católica misógina. Sólo hombres vestidos con naguas de mujer.",pq4DrEkF1sI
@LuisTorres-zd7qn,1,"Dios dale un eterno descanso a
  un    santo y un padre para pobres   
un maestro para personas que no eran catolitos . Y para muchos un papá",pq4DrEkF1sI
@MotoTigog24-l8l,1,"Que triste ver que permitió la homosexualidad
Cuando la biblia no lo permite",pq4DrEkF1sI
@MayitoenriqueSanchez,0,"Ha muerto la mierdad comunista mas grande del Mundo ,bastardo reunenete con Fidel castro",pq4DrEkF1sI
@Juan-v9c,0,"Ante la vista de Dios,Muertos enterrando muertos,tantos católicos hay?asu toda ésa gente no hacepta los mandamientos de Dios?Exodo 20;08,No haceptan el Sábado como día de reposo u si el domingo?asuu",pq4DrEkF1sI
@JorgeraulAyala-m8k,0,Que circo.puro lujo. Diabólicos peregrinando. Y la gente les cree .que poco amor asi mismo se tienen.  Satánicos peregrinando.,pq4DrEkF1sI
@Juan-v9c,0,"Muy devoto de la virgén? PERO LE ESCUCHÉ QUE DIJO LOS IDOLOS ES PERDIDA DEL ALMA,NO ESCUCHAN,NO RESPONDEN DIJO .QUE ADOREMOS A DIOS NO A ÍDOLOS",pq4DrEkF1sI
@Juan-v9c,0,No es que hera Dios?sería inmortal!!ahora los católicos y evangélicos esperarán a otro dios negro para que le adoren los domingos? En aus iglesias?,pq4DrEkF1sI
@Juan-v9c,0,"Asu,tanto siego,o muertos enterrando a muertos?,anticristo😊",pq4DrEkF1sI
@MarceloNaveyra,0,No va a aver otro papa igual😢🇦🇷🇦🇷🖤🙏🙌,pq4DrEkF1sI
@paulalavariega6035,0,Bendito seas padre santo !! 😢🙏,pq4DrEkF1sI
@bettinacarrizo1338,0,"Qué pena, se fue como Bergoglio y nunca volvió a nuestro país, a su país. Hoy ya es del mundo.
QEPD🇦🇷🇦🇷🇦🇷",pq4DrEkF1sI
@mariairmaaguayohinojosa,0,virgencita cubrel con tu manto lleno de Amor estará presente ❤🙏🌿🙏🌾🙏🙏🙏🙏🙏,pq4DrEkF1sI
@DonaldMark-ne7se,293,"Trump's tariffs may boost some U.S. industries by raising import costs but could hurt companies reliant on foreign materials and trigger retaliatory measures, harming exporters. The resulting trade uncertainty and higher costs may cause market volatility, with mixed effects on U.S. stocks overall.",QToQ03E0qWg
@Stillwater23-q5r,3,RFK rolling around under the hot dog lights😄,QToQ03E0qWg
@rad9541,2,"If tariffs are good,  then why are they paused ?",QToQ03E0qWg
@Julie-bp8jd,2,Glad I got all my vaccinations when I was in the 4th grade a very very long time ago 👍. Come with me if you want to live 😊😊,QToQ03E0qWg
@billcudd7844,2,Bubba Trump,QToQ03E0qWg
@aplsed,1,"This is how I get my news now. Sure, our country's public image is going down the drain faster than the economy but at least we can _all_ laugh about it",QToQ03E0qWg
@Therazorschannel,1,I’m pretty sure Colin gets told what to do at home because his jokes are terrible. He can’t concentrate.,QToQ03E0qWg
@carlagreene2887,1,TRUMP IS A BIGGER FOOL THAN THAT BIG BODY HE HAS WHAT A BIG BUTT ON A WHITE DUDE AND HIS LIES ARE OUT OF THIS WORLD.,QToQ03E0qWg
@neutravlad,1,"WOW! Colin, you missed a big opportunity to say ""OnlyHens"" 😂",QToQ03E0qWg
@danholm4952,1,"Some of us with union pensions (that the gop cant take) and $$ ? Are TIRED of caring! I get many innocent folk's will suffer that are not cons, but did you vote? I say let the mostly rural wt folks (many on snap, Medicaid etc) PAY! Let em git thar freebies cut! They voted against thar best interests!  Im not paying taxes with my $$ and pension for tax breaks for the billionaires that got trump elected!  IF you have taxable income? HIDE IT! They can cheat and lie? WHY CANT WE ALL?
Already hiding $$ to avoid taxes (like the rich)!",QToQ03E0qWg
@tanisha.r.thomas,1,That kid labor joke hit so hard!!!!😮😮😮😮😮,QToQ03E0qWg
@JasonMeyer-q1j,1,Watching your skits feels like an eternity. I never get to watch the rest of Saturday Night Live because I fall asleep during them.,QToQ03E0qWg
@XtoriezNovel,1,Trump is giving the country a much needed diet. GO TRUMP!!,QToQ03E0qWg
@InverseofAbstersive,1,Stating your pronouns is obnoxious.,QToQ03E0qWg
@cz2165,1,trumps hair is a different color in each of those clips.,QToQ03E0qWg
@Julie-bp8jd,1,The people who don't want fluoride in their water probably don't like brushing their teeth. The dentists will love them 🤑,QToQ03E0qWg
@marlinhicks,1,Having the kids snitch in the teachers is crazy,QToQ03E0qWg
@Jenny4_4,0,Hes of the 10 percent that are normal or humpy .. ya we are all pink and lime 90 percent .. ya me and my family and friends .. ya 10% are normal or humpy .. they share a different parent than most of us .. ya 💯 💯 💯,QToQ03E0qWg
@JennyChristensen777,0,"Colin, use the POCKET WHIP APP on Trump! He's Fired!",QToQ03E0qWg
@TeslaEVolution,0,Trumpy likely didn't know how tariffs work!!!!!,QToQ03E0qWg
@FUBAR1986,1,"Explain how somebody is in our country illegal gets any of our due process now you get your ass kicked out bye. See you later. Have a good life, but not here.",93_-p9bNsT0
@thomaserdmann7446,1,Which part of he already has a deportation order don't these dumbascraps understand,93_-p9bNsT0
@robertcarlin6628,1,"More maga bull crap,  How about due process??  He has a house and family waiting for him. Arrest and convict this DRAFT DODGER and convicted felon!! Send him away to serve his time!! Fake president!!",93_-p9bNsT0
@kbraxton45,1,What a bunch of BS and sick people,93_-p9bNsT0
@priztucker,0,Sending him to Gaza his hilarious,93_-p9bNsT0
@albertbeard9113,0,Deflection anybody??,93_-p9bNsT0
@Rubyred-rb2fe,0,Send Scott to Gaza,93_-p9bNsT0
@GhostDrummer,0,Send him to Gitmo…🤯🤯🤯,93_-p9bNsT0
@JellybeansAZ48,0,Garcia can be on house arrest in these loonies' homes,93_-p9bNsT0
@marvieliss7,0,"First of all, when talking to these people, you can't start any question with, ""do you think.....""",93_-p9bNsT0
@von833,0,Foreigners protecting foreigners,93_-p9bNsT0
@richardburdon3241,0,send him to Ukraine,93_-p9bNsT0
@yankbat8481,0,We had dozens of Americans over seas held by bad countries yet none them lobbied for Americans except Trump. Yet. Bring the illegals and felons back lol,93_-p9bNsT0
@yankbat8481,0,lol. Libs are just mindless,93_-p9bNsT0
@johnfarrell3114,0,"If he was taken in error, man up admit you made a mistake",93_-p9bNsT0
@johnfarrell3114,0,I wonder how you would feel if it was you or your son,93_-p9bNsT0
@johnfarrell3114,0,I wonder how you would feel if it was you or your son,93_-p9bNsT0
@johnfarrell3114,0,"He has to be deemed a threat, then if he is found, by due process, guilty this should be in effest",93_-p9bNsT0
@maryshipman1254,0,Oh my god they are still talking about this? Move on.  Don't bring him back,93_-p9bNsT0
@billganas467,0,"i have a better idea,  send the Judge to el salvador",93_-p9bNsT0
@Bestitwest,1,Trump continues with his extortion.,x8QwEqKHI6Y
@kmlund42,1,What a huge loss. 60 minutes is as American as you can get and Trump pushing them out?? This power thing is enough now and needs to stop. Do not obey ahead of time. Do NOT CAVE!!!,x8QwEqKHI6Y
@MARGORYPlacha,1,This is crazy. Trump suing over the Kamala interview  is stupid. 60 Minutes was much more fun when they did the hidden camera stuff.,x8QwEqKHI6Y
@TheDanHansen,1,Teslas up 7% today we need to pull out now. Stop 🛑 investing in Trump stock games.,x8QwEqKHI6Y
@SandysSerenityCorner,1,"“Why does Trump have the power?” Answer: because he controls not only the executive branch, he also controls Congress, the Senate and the Supreme Court. That plus the money and support from the three wealthiest men in America.",x8QwEqKHI6Y
@queenmillionaire,1,This is the result of too many mergers in the first place. Consolidation of media outlets is ruining journalism. The billionaires gaining from the mergers are destroying democracy with their greed.,x8QwEqKHI6Y
@zefdin101,1,"It wasn’t ‘silly’ for 60 minutes and CBS , that have gone on and on about ‘election interference’ to then edit VP Harris in a way to make her appear less bubble-headed. The context is critical and you knowingly or unknowingly seem not to address this fact. The event happened in the final stretch of the 2024 Presidential election, an intensely critical time, Harris was under immense scrutiny because many observers were commenting on her inability to string a coherent sentence together and many thought this made her unfit for the job. The fact that 60 Minutes allowed this clip to be altered in a way that impacted directly on the way she would be perceived in this context was inexcusable and Donald Trump and his team are 1000% correct to hold 60 Minutes to task on this.  Silly you say? I’m sure the network that is on the precipice of paying millions and apologizing for its actions isn’t feeling silly today. Good for President Trump for calling this bias out and winning too!",x8QwEqKHI6Y
@xliquidflames,0,Doesn't quitting just leave a vacancy to be filled by someone more loyal to Trump? I would think you want them to keep their jobs and try keep it honest from the inside.,x8QwEqKHI6Y
@sarahphillips8987,0,"Too bad they are folding. Because up until now, they were going all out with the stories.",x8QwEqKHI6Y
@Pawny1-r1z,0,"Trump would sue a mosquito for drawing a little tainted blood. 
He is a huge disgrace to  honesty and integrity.",x8QwEqKHI6Y
@billhannaford4488,0,CBS took that whole Kamala interview and cut and edited it to not make her look like the dimwit she is. Check out the uncut version. CBS knows they screwed up and they need to pay up to Trump. Just like ABC had to pay over anchor George Stephanopoulos’ inaccurate on-air assertion that Trump had been found civilly liable for raping- they lost big time for fake stuff he said. Look it up.,x8QwEqKHI6Y
@1truth777-o7j,0,"You guys pretend the news is not trying to get only democrats elected, then you complain about someone suing about it? Grow up…",x8QwEqKHI6Y
@wendywilson1537,0,Harvard is completely wrong.  Bob Jones University lost their tax exempt status because they were not following the civil rights act just like Harvard is doing now.,x8QwEqKHI6Y
@wendywilson1537,0,60 minutes is old news that nobody watches anymore.,x8QwEqKHI6Y
@wendywilson1537,0,He quit because he didn't want to apologize.  He's a coward.,x8QwEqKHI6Y
@sgallant2107,0,"Maybe 60 Minutes should do an exposé on Trump's limitations and stranglehold on the Main Stream Media.

It used to be what they were famous for!",x8QwEqKHI6Y
@mikaylapenland490,0,Another one bites the dust,x8QwEqKHI6Y
@JoyMoore-l9w,0,We should call for a boycott of CBS!,x8QwEqKHI6Y
@gregfaris6959,0,"34 years of unabashed slanted propaganda.
All bad things nust come to an end.",x8QwEqKHI6Y
@sheilahargrave2639,0,"When you see the entire 60 mins unedited, it did not change anything favorable or not.  It just used a few seconds as a blurb of upcoming, as they all do.",x8QwEqKHI6Y
@Mcmannbev,20,Has anyone ever seen so many planes on fire these past few months?,_hjqc5i9tg4
@codylewis8359,11,Staying domestic and road-tripping looking a lot more appealing now,_hjqc5i9tg4
@mistymesh-qe6yh,11,"This doesn’t make any sense yesterday another plane had the same problem in Chicago now,  here in Orlando. Last week in Puerto Rico, and a week before that  a helicopter crash in New York City.
This can’t NOT be a coincidence something or someone is doing this. I pray🙏 it’s NOT a terror attack, and we’re too blind to see this. May God be with all of us.",_hjqc5i9tg4
@ltsflwrbmb,5,Tf is going on?,_hjqc5i9tg4
@donnadodd8355,3,Delta. Don't Ever Leave The Airport,_hjqc5i9tg4
@rosapestana2448,3,"What’s is happens, with the airline lately ? Employee are not experience like manny years ago ? They consume looking to the internet , not more responsible employee , happens every were ! Hospital , Drs office , employee are in the Moon 🌙! This past and today generación are not ready to take responsibility in any Job ! The true hurt .ufff! 😢😢😢😢",_hjqc5i9tg4
@sandydudukovich2018,3,"Why are there so many fires, crashes , and other emergencies on airplanes and helicopters in the last few months. I hope these are being investigated to get to the bottom of this.",_hjqc5i9tg4
@carolsmith4119,2,Thank God they were not in the air but on ground.   God is good!  Everyone is safe! ❤❤❤,_hjqc5i9tg4
@straycats6,2,TG they were on the ground,_hjqc5i9tg4
@mopthermopther,2,"what was it now ?
rabbit, bird, Army helicopter ?",_hjqc5i9tg4
@bingovegas4867,2,"When we DONT see or hear bad news, thats when we should worry...",_hjqc5i9tg4
@accessdenied9105,1,All I could say’ is that my safest & peaceful flight’s has been on a Delta plane! ✌🏾,_hjqc5i9tg4
@LaxTenzin,0,Welcome to turning of America into to third world now under Trump and Elon administration,_hjqc5i9tg4
@Christopher-n9c2b,0,"Am I the only one who KNOWS these are fake news / staged propaganda… all because in the near future they want YOU to be scared of flying and at the same time only the Rich will fly 

Thanks to channels like nations conspire and ones that can see 

I’m not buying any of this plane stuff",_hjqc5i9tg4
@AmyHammett-o4l,0,By who,_hjqc5i9tg4
@benzeeable1,0,Retire those old airplanes.,_hjqc5i9tg4
@coralee1705,0,Marco,_hjqc5i9tg4
@SteveSelid,0,Maybe say what kind of plane,_hjqc5i9tg4
@carmentorrez9749,0,🙏🙏🙏🙏,_hjqc5i9tg4
@VA_Biker,0,It's all Trump's fault,_hjqc5i9tg4
@cassandratq9301,1,"""Negative gestures toward US??"" As Trump raises tariffs on them by huge amounts every other day?",yEPHxZTGbLc
@truthshyt1,1,liar bs ! thats why trump try to talk to china every   ? but cn ignored,yEPHxZTGbLc
@MTrades24s,1,Hilarious,yEPHxZTGbLc
@mikeobrien7485,1,"Again, i read comments here and typical  american arogance. KEVIN OLEARY EAS SCREAMING FOR 400% tariffs  now the rubber has hit the road .",yEPHxZTGbLc
@mikeobrien7485,1,America strong armed the rest of the world.,yEPHxZTGbLc
@jacobdrollinger7214,1,We are on the decline. We have  overplayed our hand!,yEPHxZTGbLc
@yingliu-t6p,1,作为中国人，这个视频里面的男的说的很多都是胡说八道的，真不懂西方国家就是这样做新闻的？,yEPHxZTGbLc
@royho747,1,"China does not even bother to give trunp a ring, and this guy keep saying China is softening ? Still living in la la land haha",yEPHxZTGbLc
@patriciaschaefer7146,1,"Trump just made a Zero tariff agreement with India! 🎉
I'm interested how this is going to happen when India has been part of the BRICS Nation?",yEPHxZTGbLc
@SpeakOut_with_ReyCMutia_2014,1,China is a DYING DRAGON....😂😂😂😂😂,yEPHxZTGbLc
@Blackwolf-2-l3,1,"But greed of the large American corporations was the reason they moved to China and left behind American workers. We need them to pay back to us left behind in the 90’s Apple, Black & Decker, and many others that abandoned us as citizen corporations and dismantled the USA in favor of more profit. 😢",yEPHxZTGbLc
@JohnOlson-o3t,0,CHINA will pop its bubble before long.,yEPHxZTGbLc
@2hcobda2,0,3:15,yEPHxZTGbLc
@josephfuselier,0,Two Chinese Americans who were in The U.S Army/U.S Navy were arrested for  espionage against The United States Of America 🇺🇸.  This should be a Red Flag to alert recruiting officers. With the state of relations affecting China/America 🇺🇸,yEPHxZTGbLc
@josephfuselier,0,China is a greedy Communist and  Toad that wants to rule the world both economically and militarily. One does not need ro be a Rhodes Scholar/ Harvard graduate to see the bkttom line i  all of this.,yEPHxZTGbLc
@josephfuselier,0,"Bring American manufacturers back to USA.  India will buy Boeing Aircraft.  Chinese goods aral cheap manufactured junk! 
People play the lottery and the taxes on gambling could be used to start American manufacturers to begin again in America 🇺🇸. 😮",yEPHxZTGbLc
@RDBean,0,"usa can survive this, china can not",yEPHxZTGbLc
@Wakeupandsniffthecoffee,0,0:34 China reserves the rights to make their own people suffer to preserve their own leadership ego.,yEPHxZTGbLc
@NoKainga,0,China the bullies still think they can dictate and bully the world.,yEPHxZTGbLc
@edwardharrison9714,0,"Four more years of Biden and his communist Democrats 👿 would have completely destroyed us..
🔥🇺🇸🔥",yEPHxZTGbLc
