video_id,title,channel,category_id,category,views,likes,description,tags,url,published_at,comment_count,country
9trJTiOB8BE,he was born for this #shorts #funny #explore #comedy #usa #cakeboss #bake #cake #bakery #buddy #fyp,Ngamshishi,23,코미디,37178094,2120232,"Cake Boss is an American reality television series that originally aired on the cable television network TLC. The series premiered on April 19, 2009, and spawned four spin-offs: Next Great Baker, Kitchen Boss, Bake You Rich, and Bakery Boss.

On January 26, 2015, Cake Boss was renewed for two additional seasons, which aired on TLC until 2017. Season 9 premiered on May 18, 2019, with the show moving to TLC's sister network, Discovery Family. The show officially ended on April 11, 2020.",,https://www.youtube.com/watch?v=9trJTiOB8BE,2025-04-14T22:14:13Z,7379,US
9_prXKhA3u8,Dr. House reasoned in advance that the patient was going to sue him #movie #video #shorts,Matthew Amy,23,코미디,21056842,1111466,,,https://www.youtube.com/watch?v=9_prXKhA3u8,2025-04-11T13:18:00Z,1371,US
Upy-b_keHHo,Crazy Cops  #shortflim #film #cops #timeloop #loop,ShorterT,23,코미디,13348113,1282142,"Short Film Title:
Groundhog Day For A Black Man",,https://www.youtube.com/watch?v=Upy-b_keHHo,2025-04-13T15:41:15Z,7921,US
CqOYofXj3f0,Joe Rogan reacts to courtroom grilling.,mind Bytecast ,23,코미디,7789312,456983,,,https://www.youtube.com/watch?v=CqOYofXj3f0,2025-04-13T14:36:17Z,6641,US
QMc6r0gUnkM,“tHE beLl dOeSNt DisMISs yOU i dO” 🙄 #relatable #skit #dankscole #fylシ#funny #comedy #pov,Christopher,23,코미디,13318224,595254,"#interesting #happy #funnySome interesting videos for you

Any footage in this video has only been used tocommunicate a message(understandable) toaudience.According to my knowledge, it's a fairuse under reviews and commentary section. Wedon't plan to violate anyone's right. Thanks

The original author of the video content on the leftscreen is @DankScole on Tiktok.",,https://www.youtube.com/watch?v=QMc6r0gUnkM,2025-04-12T08:34:57Z,1645,US
D0flMLbvOig,Giving him sight back is making me sob 😭 #fyp #emotional #movie #shorts,PhantomShorts,23,코미디,25992496,1614470,Giving him sight back is making me sob 😭 Girl Married A Blind Man To Cheat Freely #fyp #emotional #movie #edit #shorts #interesting #relationship #film #funny #memories #viral #trending #feedshorts #blowup #youtubeshorts #diewithsmile #foryou,"julie and the phantoms season 2,julie and the phantoms soundtrack,julie and the phantoms songs,julie and the phantoms react,julie and the phantoms perfect harmony,julie and the phantoms wake up,julie and the phantoms stand tall,julie and the phantoms ending,julie and the phantoms,julieandthephantoms,edge of great,jatp,jatp full episodes,descendants,Disney karaoke,Disney shows edit,Netflix series,What to watch,Movie,julie and the phantoms 2,jatp song,teen,comedy",https://www.youtube.com/watch?v=D0flMLbvOig,2025-04-12T20:25:50Z,2020,US
uCoWA-73y44,#short,Nahshon Slater,23,코미디,6116237,215718,,,https://www.youtube.com/watch?v=uCoWA-73y44,2025-04-15T03:18:32Z,1253,US
aEaGaUFHLhI,That principal needs to be fired! 😤,xunmasked,23,코미디,12879126,827392,That principal needs to be fired! 😤,,https://www.youtube.com/watch?v=aEaGaUFHLhI,2025-04-12T19:00:00Z,4021,US
EDaSAXhgB7Q,“I Demandeth An Apology” 😭 #film #movie #viralvideo #explore #fyp #shorts #cinema,SniperXplug,23,코미디,8709610,0,,,https://www.youtube.com/watch?v=EDaSAXhgB7Q,2025-04-14T02:04:29Z,1070,US
OEdp_ZefzHY,Had to pull out the bob💁🏻‍♀️,SIMJI,23,코미디,12030984,387250,"Instagram/TikTok - @simjiofficial
My Shop: https://simjishop.com/
My Links: https://linktr.ee/Simji","rug tufting,tufting rug,tufted rug,tufting a rug,tufting,carpet tufting,tufting gun,simji,custom rug,how i tuft a rug,how to tuft a rug,simjiofficial,simji rugs,how to make rugs,how to make custom rugs,diy rugs",https://www.youtube.com/watch?v=OEdp_ZefzHY,2025-04-14T18:30:36Z,1394,US
lE5HjPa4fHM,Zack Later Went to Federal Prison…,Matthew Cox Shorts,23,코미디,8556264,449609,,,https://www.youtube.com/watch?v=lE5HjPa4fHM,2025-04-12T21:35:25Z,3245,US
s1vNeokpJ3c,"In all fairness,you the first robbery here today.#viralvideo #shortvideo #shorts",Mccowan784,23,코미디,6780698,517835,,,https://www.youtube.com/watch?v=s1vNeokpJ3c,2025-04-14T13:03:00Z,1953,US
tvwKsRx16zo,Big Surprise for Delivery Driver! #shorts #trending #viral #love #hearttouching #happy #community,Shiba Diva,23,코미디,7084670,753127,,,https://www.youtube.com/watch?v=tvwKsRx16zo,2025-04-11T15:03:00Z,2818,US
UvAnYnJDpJc,NO WAY he actually made it 🤯 @gmgolf,Dude Perfect,23,코미디,66643523,2597769,,,https://www.youtube.com/watch?v=UvAnYnJDpJc,2025-04-10T18:43:22Z,3420,US
_GyYqJMUYG0,DO YOU KNOW #duet #react #myreaction #reaction #tiktok #comments,LAURI REACTION AND AIRBRUSH MAKEUP ,23,코미디,5442866,470519,"Hi my name is Lauri Reaction👀 I create reaction content I just want to make you laugh and feel better when I post my reactions to some  very funny content I love to hear all of the responses an reactions to the content I make on here please make sure to leave comment please don't forget subscribe share with the people you love ❤️ 💕 y'all 


https://www.youtube.com/@LAURIREACTIONANDAIRBRUSHMAKEUP



tiktok 🤩

Instagram  😆

Facebook 😅
        
Snap chat 🤣                                                                                  


Copyright Disclaimer: - Under section 107 of the copyright Act 1976, allowance is mad for FAIR USE for purpose such a as criticism, comment, news reporting, teaching, scholarship and research. Fair use is a use permitted by copyright statues that might otherwise be infringing. Non- Profit, educational or personal use tips the balance in favor of FAIR USE.","reaction,react,myreaction,tiktok,comments please",https://www.youtube.com/watch?v=_GyYqJMUYG0,2025-04-12T19:37:39Z,32251,US
1ggf3mT_p1o,Shane Gillis Does His Asian Voice as a Ref‼️🤣😂 | Pat McAfee’s Big Night AHT #shanegillis #sumo,Talks Of The Town Comedy,23,코미디,4614107,238321,,,https://www.youtube.com/watch?v=1ggf3mT_p1o,2025-04-13T17:19:47Z,1459,US
3d0Xrfm2M7s,Flames are not well received in Element City #shorts #movie #elemental,dave galvin,23,코미디,11501183,837301,,,https://www.youtube.com/watch?v=3d0Xrfm2M7s,2025-04-13T14:00:04Z,1014,US
xPBK4GKzV-s,Time travel to the 1960s 😄 | 11.22.63 | #movie,My Movie,23,코미디,9160257,513935,11.22.63,,https://www.youtube.com/watch?v=xPBK4GKzV-s,2025-04-12T09:01:19Z,4979,US
ZaxUFXfH5L4,He bought a knife from a mugger #tvshow #shorts #kimsconvenience,Dzqly 401,23,코미디,5959551,506533,,,https://www.youtube.com/watch?v=ZaxUFXfH5L4,2025-04-15T13:18:56Z,910,US
qSpkeWAACZE,8yo Magician Shocks KSI On Britain's Got Talent,Viralform,23,코미디,34854990,1761093,,,https://www.youtube.com/watch?v=qSpkeWAACZE,2025-04-07T16:17:07Z,2427,US
xycGVn3kC9c,Create a Word CHALLENGE 😂💀 Pt 4,Barely Friends,23,코미디,7190312,293907,"Create a Word CHALLENGE 😂💀 Pt 4 (Bombardino Crocodilo Edition)

Welcome to our brand new channel! Drop a sub ❤️

For clarity, we are no longer with Full Squad Gaming. Appreciate all the support

Guess the Imposter Challenge

Guess the spy challenge

Guess Your Person Challenge

#shorts #challenge #imposter","full squad gaming,full squad gaming imposter,imposter,heads up,guess your person,whos lying,challenge,podcast,guess your person challenge,avalanche,mike,nick,where is classy full squad gaming,italian brainrot,bombardino crocodilo,bombonbini guzzini",https://www.youtube.com/watch?v=xycGVn3kC9c,2025-04-15T02:30:51Z,2395,US
u33TZj0lIGI,FORD vs Ferrari | He didn’t know who he was talking To #foryou #shorts,Toxic Couple- (Alg-Ua),23,코미디,6045005,431221,"✅ ""Want to watch the best movies & TV shows? Try Prime Video for FREE! 🎥📺 Click here: [http://www.amazon.de/gp/video/primesignup?tag=ihre_partner_id-21] Enjoy unlimited streaming for 30 days!""

Donation Paypal : https://www.paypal.com/donate/?hosted_button_id=PRC29WB4XBEJC

Your Support:https://www.buymeacoffee.com/ayoubandviktoriia

Join this channel to get access to perks:
https://www.youtube.com/channel/UCJPG9aXuxooQeQjnnKSKr7A/join

#reaction  #comedy #funny #toxicpartner #talktv #couple #song #shorts #netflix #movie #movieclips #moviestar #movies #moviereview #whatthemovie #film #foryou #fyp #moviemovie #fypシ゚viral #fypage #fypyoutube #american #car #cars #race #racecar #racer #basedontruestory #ford #ferrari #fordvsferrari #speed 

IF YOU WOULD LIKE TO SEND ME ANYTHING THROUGH THE POST, THIS IS THE ADDRESS TO USE! 
                                                   
👋 SOCIALS 👋 
► INSTAGRAM:Ayoubnjr10  
► INSTAGRAM:toxic_beauty_vi
► INSTAGRAM:couple_toxic_ua_alg  

► TWITTER:jr10ayoub32283  
   
► TIKTOK :ayoubstylelife  
  
NEW VIDEOS EVERYDAY! Subscribe and turn on notifications so you don't miss any!

Click Here To Subscribe: @ToxicCouple-Alg-Ua

Copyright Disclaimer Under Section 107 of the Copyright Act 1976, allowance is made for ""fair use"" for purposes such as criticism, comment, news reporting, teaching, scholarship, and research. Fair use is a use permitted by copyright statute that might otherwise be infringing. Non-profit, educational or personal use tips the balance in favor of fair use. No copyright infringement intended. ALL RIGHTS BELONG TO THEIR RESPECTIVE OWNERS","1966 Le Mans,Caitriona Balfe,Christian Bale,James Mangold,Jenno Topping,Jon Bernthal,Josh Lucas,Matt Damon,Noah Jupe,Peter Chernin,Ray McKinnon,Remo Girone,Tracy Letts,Trailer,based on a true story,disney fox,disney trailer,ferrari,film enthusiasts,film reaction,first time reaction,first time watching,ford,ford v ferrari,james mangold directing,movie reaction,movie review,trailer reaction",https://www.youtube.com/watch?v=u33TZj0lIGI,2025-04-13T21:00:45Z,1271,US
ZGwFd7TCSbw,What does this mom do when her daughter decides to become vegan?#shorts #video #comedy #story #tv,Paul Jordin,23,코미디,10487684,503991,,,https://www.youtube.com/watch?v=ZGwFd7TCSbw,2025-04-14T01:45:11Z,1643,US
UtxG9ZJW5Qo,"Ranking ""I Make The Face You Make The Sound"" Trend-part4",FailFiles,23,코미디,12280969,692571,"Ranking ""I Make The Face You Make The Sound"" Trend""-part4

#IMakeTheFaceYouMakeTheSound
#FaceSoundTrend #FunnyTrend
#TryNotToLaugh #RelatableContent
#FunnyReactions #ComedyContent
#RankingTrend #TrendRanking
#TrendCompilation #ReactionVideo
#MemeRanking #FunnyCompilations",,https://www.youtube.com/watch?v=UtxG9ZJW5Qo,2025-04-13T13:54:41Z,1165,US
YLpCiHNLSsM,Maya got ripped off.#show #shorts #shortvideo #maya #rip #funnyshorts #funny #girl #meet #world,Stephanie,23,코미디,6733250,429825,,,https://www.youtube.com/watch?v=YLpCiHNLSsM,2025-04-13T13:35:02Z,823,US
eZM5q_LdyFg,The Friendship-Destroying Game,Brain Boost,23,코미디,11696386,570846,#sub,,https://www.youtube.com/watch?v=eZM5q_LdyFg,2025-04-13T18:10:42Z,3299,US
HCqqUqopI8I,Jack Black Is Now Needed To Save The MineCraft Movie 😭,Mark Beshae,23,코미디,5357911,258998,,,https://www.youtube.com/watch?v=HCqqUqopI8I,2025-04-15T00:47:12Z,1804,US
_bf6wpOH9kI,The Truth About Anthony Mackie Stopping Playing Football#shorts #AnthonyMackie,Chiong Minniear,23,코미디,4986780,327662,,,https://www.youtube.com/watch?v=_bf6wpOH9kI,2025-04-11T06:35:48Z,1148,US
KIttwGQYoLw,BABY SWITCHED with a DOLL and Tossed Into the SEA!? 😨,Prank Me Later,23,코미디,16117340,397666,"🚀 How to make $1,000 per video with 0 followers: https://bit.ly/BFormula
👩🏼‍💻 VIRALISH: http://viralish.com


#comedy #pranks #couplespranks #couples #comedyvideo #tiktokpranks #prankvideo #prankideas #wildpranks #prankmelater #funnyvideos","funny videos,funny tiktoks,funny pranks,funny shorts,funny compilation,funny friends,viral,viral videos,viral prank,viral shorts,best compilation,best pranks,best shorts,Pranks,Prankster,Prank challenge",https://www.youtube.com/watch?v=KIttwGQYoLw,2025-04-11T06:41:34Z,1962,US
r9ZD-f4ShDg,They bought lotteries with all their money and stayed in the black😱#jerryandmargegolarge #movie,House Of Geniuses,23,코미디,11385020,926967,They bought lotteries with all their money and stayed in the black😱#jerryandmargegolarge #movie,,https://www.youtube.com/watch?v=r9ZD-f4ShDg,2025-04-11T00:16:54Z,1221,US
D5MQ0xQGUjs,Lord of the Plains#movie #western #shorts,Movie Travel,23,코미디,4043830,136873,,,https://www.youtube.com/watch?v=D5MQ0xQGUjs,2025-04-14T21:00:20Z,1065,US
7y-WbmmaD_M,Who Did It The Best? “i Am Steve” Jack Black & A Minecraft Movie Cast #shorts #jackblack #minecraft,Jarred Jermaine,23,코미디,5294199,269996,,,https://www.youtube.com/watch?v=7y-WbmmaD_M,2025-04-15T21:46:20Z,3718,US
uVD0Chu5YyU,You thought cheaper means would save you money… until the repairs cost double. 😩 #bathroomgoals,First Choice Bathroom Remodeling,23,코미디,26891766,1017355,Don’t make the same mistake—let our experts handle your renovation the right way! 🛠️ Let’s get started today! #RenovationDoneRight,"home reno,bathroom renovation,bathroom remodeling in a abudget,Conecticut contractor,bathroom contractor,small bathroom ideas",https://www.youtube.com/watch?v=uVD0Chu5YyU,2025-04-07T14:17:24Z,3365,US
7XycbVs43l0,The chief humiliated the billionaires😳,Snow Moments,23,코미디,4265389,256641,,,https://www.youtube.com/watch?v=7XycbVs43l0,2025-04-16T22:50:00Z,1487,US
rizKmgm6X4Y,He slamming into the walls and still going 😂😂😂 #shorts #viralvideo #youtube,PacRackz,23,코미디,8887522,435483,He slamming into the walls and still going 😂😂😂 #shorts #viralvideo #youtube,"Shorts,YouTube shorts",https://www.youtube.com/watch?v=rizKmgm6X4Y,2025-04-10T22:48:57Z,7273,US
GOegpa7v61k,We will never see comedy like this again,NXCRE,23,코미디,9100043,472522,,,https://www.youtube.com/watch?v=GOegpa7v61k,2025-04-09T23:00:10Z,1083,US
hQFs0D5_XYE,He Yelled CHICKEN JOCKEY!!!,BolingBros,23,코미디,14287622,462655,,,https://www.youtube.com/watch?v=hQFs0D5_XYE,2025-04-09T19:30:35Z,3592,US
cyjlhVtJdx8,Snoop Dogg Never Have I Ever,ViralMind,23,코미디,10026554,717903,,,https://www.youtube.com/watch?v=cyjlhVtJdx8,2025-04-10T12:59:43Z,693,US
9-Qu8QOrDoY,"When the kids tell you something sad, but you’re struggling not to laugh #coach",Chloe Lee,23,코미디,6453810,185786,"#interesting #happy #funnySome interesting videos for you

Any footage in this video has only been used tocommunicate a message(understandable) toaudience.According to my knowledge, it's a fairuse under reviews and commentary section. Wedon't plan to violate anyone's right. Thanks

The original author of the video content on the leftscreen is @clair_hawkins Tiktok.",,https://www.youtube.com/watch?v=9-Qu8QOrDoY,2025-04-11T11:11:00Z,323,US
_CnHPMZzkiE,Bill Burr Exposes The Military,PrestigeForm,23,코미디,5092831,236225,,,https://www.youtube.com/watch?v=_CnHPMZzkiE,2025-04-12T19:00:33Z,2757,US
1TjdYCdjmyM,Reddington stopped a sports car.#blacklist #shorts #viralvideo #shortvideo #fyp #tvshow,Jordan Recapped,23,코미디,9109118,537991,,,https://www.youtube.com/watch?v=1TjdYCdjmyM,2025-04-11T15:54:00Z,1540,US
5AUqyBIUzQ8,Full Video 👆,Vlog Creations,23,코미디,2666718,185770,"Become a member 
Https://www.realpranks.com","rosscreations,ross,creations,funny,hilarious,stunt,vlog,comedy,creationsross",https://www.youtube.com/watch?v=5AUqyBIUzQ8,2025-04-16T22:17:49Z,992,US
q09lsczHzEE,The guy has amnesia #therookie #tim #lucy #foryou,maki movie,23,코미디,9245173,621373,,,https://www.youtube.com/watch?v=q09lsczHzEE,2025-04-11T02:27:01Z,486,US
vwaXqJFybwk,Ranking Best I Make The Face & You Make The Sound Challenge (pt.2),MrPurifiedWater,23,코미디,11201542,557480,#funny #funnyvideos #ranking #funnyshorts,,https://www.youtube.com/watch?v=vwaXqJFybwk,2025-04-12T17:37:14Z,1648,US
EVrqbzFNXKY,Ranking the worst slide fails moment #fails #ranking #funnyfails,Ranking Shorts,23,코미디,15189871,363164,This video is for entertainment and educational purposes only and is not intended to misrepresent or cause harm.,,https://www.youtube.com/watch?v=EVrqbzFNXKY,2025-04-13T09:31:59Z,703,US
VbRNxn_X7hE,Speed caused his Fan to get kicked out of his Team!😭,SpeedKaiClip,23,코미디,12423210,668902,"One of Speed's fans sent him a racist message, and Speed decided to punish him, which led to the fan being kicked out of his team.

Follow Speed's Socials:
Main channel -  https://youtube.com/@IShowSpeed
Instagram - https://www.instagram.com/ishowspeed
TikTok - https://www.tiktok.com/@ishowspeed

KaiCenat and IShowSpeed Shorts
#ishowspeed #shorts #speed","ishowspeed,speed,fans,ishowspeed fan,ishowspeed fans,ishowspeed DM,IShowspeed shorts,speed shorts,shorts,ishowspeed funny moments,speed clips,speed funny,speed fans,ishowspeed funny,speed funny clips,ishowspeed moments",https://www.youtube.com/watch?v=VbRNxn_X7hE,2025-04-09T16:18:45Z,4196,US
4wOpPxrcUsM,DR: I’ve always wanted to say that.#show #shorts #shortvideo #doctorwho #doctor #say #want #tv #wow,Brought Kooky,23,코미디,2907490,236624,,,https://www.youtube.com/watch?v=4wOpPxrcUsM,2025-04-16T15:06:00Z,386,US
fDcJ2qGyTlE,An excellent pilot can take off even on a very short runway #movie #shorts #viralvideo,Wallace AM,23,코미디,5384056,201104,,,https://www.youtube.com/watch?v=fDcJ2qGyTlE,2025-04-14T01:30:33Z,652,US
2TW5V8_S92w,Right message wrong messenger #relatablestories #comedy #funnymemes,Tyler Vitelli,23,코미디,4568445,351996,"This is a funny meme mixed with storytelling style video about how my friend wouldn’t let me eat my donuts cuz he thought these were unhealthy but turns out what he was doing was way worse than what I did. The ending is actually funny!

#storytelling #funny #relatable #shorts #memes",,https://www.youtube.com/watch?v=2TW5V8_S92w,2025-04-14T17:27:28Z,3265,US
8BAeFL6fXs4,He would not torture a defenseless animal#movie #shorts #viralvideo,John Movie,23,코미디,21138989,1172024,,,https://www.youtube.com/watch?v=8BAeFL6fXs4,2025-04-07T02:05:06Z,3856,US
