category,categoryId,channelTitle,commentCount,country,description,id,likeCount,publishedAt,tags,title,url,viewCount
people_blogs,22,인생뭐있어,467,KR,당근에서 일당 10만원 이사도우미 갔다가 당한일,FrtihXlnGGA,39157,2025-04-04T04:40:00.000Z,,당근에서 일당 10만원 이사도우미 갔다가 당한일,https://www.youtube.com/watch?v=FrtihXlnGGA,1149955
people_blogs,24,썸머썸머,348,KR,이 영상은 셀리맥스의 유료광고를 포함하고 있습니다!💚  💚셀리맥스 시카 지우개 패드 리뉴얼 특가💚  ~59% 할인 링크 ➡️ https://bit.ly/4clVsxR  ✅전 회원 6천원 추가 할인 쿠폰 증정! ✅기간 : 4/15(화)~4/29(화)  📌 시카 패드 본품 1개 + 리필 2개 구매 시   ✅시카 수딩 크림 본품 + 시카 마스크 팩 2개 + 시카 패드 10매입 2개 + 휴대용 케이스 추가 증정 67 000원 ➡️ 34 000원 (49%🔽)  📌시카 패드 단품 구매 시  ✅ 시카 패드 10매입 3개 추가 증정 24 000원 ➡️ 9 900원 (59%🔽)  📌환절기에 올라오는 각질 순하게 제거하고 싶은 분들!!! 세안 후 제일 첫 번째 단계에서 시카 지우개 패드로    각질  피지  메이크업 잔여물 같은 피부 속 노폐물 싹 청소하고 매끈 촉촉 깐달걀 피부결 만들어보세요✨   💚구독자 댓글 이벤트💚  해당 영상 댓글로 셀리맥스 시카 지우개패드를 사용해보고 싶은 이유를 써주세요!  참여 기간 : 2025.04.28 (월) 오후 11시 59분까지  당첨자 발표 : 2025.05.12 (월) *썸머썸머 고정댓글 공지  선물 : 시카 지우개 패드 본품 1개 (30명)   ►썸머 채널 VIP가입으로 라이브 풀영상 전체 다시보기:  https://www.youtube.com/channel/UCCCjbf-1ESumTxBlflQSQIQ/join ►INSTAGRAM www.instagram.com/@summerinbk ►Business Inquiries only (비즈니스 관련 메일): summerinbk@gmail.com ►입고 있는 옷  화장품들 링크모음  ►썸머가 쓰는 아마존 추천템들 https://www.amazon.com/shop/summerinnewyork?ref_=cm_sw_r_cp_ud_aipsfshop_S6ET1JHFH6KPTRVN2TJZ   해당 채널의 모든 저작권은 썸머썸머 Summer in New York 에 있으며  단순 링크 공유 외 영상 일부 혹은 전체의 무단게시를 금지합니다.  All rights reserved. No part of this publication may be reproduced  distributed  or transmitted in any form.  ••••••••••••••••••••••••••••••••••••••••­­­•••••••••••   Some of the links are affiliate links  which means I may earn a small commission if anyone purchases through it and it does help me to keep on making videos for you guys  thank you! 위 링크 중에는 상품 구매시 제게 소액의 커미션이 생기는 추천인 링크가 포함되어 있을 수 있습니다. 영상 제작에 도움 주셔서 감사합니다!,QI78RncXjg0,3008,2025-04-16T11:00:52.000Z,[미국일상  썸머  썸머썸머],맨하탄 찐부자들이 간다는 마켓 탐방🛒 동네엄마인 척 하고 쇼핑하기!,https://www.youtube.com/watch?v=QI78RncXjg0,167122
people_blogs,22,[하말넘많] heavytalker,48,KR,💙 미공개&비공개 영상이 가득한 하말넘많 멤버십 ⬇⬇⬇ https://youtube.com/c/하말넘많heavytalker/join,jknmpvHKZKE,2883,2025-04-19T13:01:17.000Z,,미친(positive) 관자의 등장,https://www.youtube.com/watch?v=jknmpvHKZKE,57036
people_blogs,22,승아로운,132,KR,#윤승아 #승아로운 #브이로그  📍이 영상의 저작권은 승아로운 채널에 있습니다. 상업적 목적의 사용이나 브랜드 홍보  협의되지 않은 콘텐츠의 활용과 2차 편집 사용을 금지합니다.  📍인스타그램: http://www.instargram.com/doflwl 📍비즈니스 이메일: 프레인tpc 광고팀 praintpc_ad@prain.com,1J3GX4z0IFo,774,2025-04-20T02:00:02.000Z,[윤승아  승아로운  다이어트  유지어터  식단브이로그  브이로그],굶지마세요  유지어터의 일주일 식단!,https://www.youtube.com/watch?v=1J3GX4z0IFo,40227
people_blogs,22,콩빈Cong Been,200,KR,* 이 영상은 바이오던스의 유료광고를 포함하고 있습니다.  🤫바이오던스X콩빈 구독자 비밀 혜택🤫 기간 : 4/14(월)~4/17(목) 딱 4일만! 구매 링크: https://bit.ly/3DAS2dy  이 링크를 통해서 구매하면 1️⃣전 구매고객 무료배송 2️⃣7만원 이상 구매 시 바이오던스 에코백 증정 (선착순 100명) 3️⃣마스크  앰플  패드 ~28% 할인+증정  Q. 콩빈이 추천하는 구성은? A. [옵션2] 또는[옵션3]! 지금 비타 마스크팩은 여기가 최고 할인! 특히 바이오던스 팩은 진짜 자주 쓰게 돼서 💙최대 혜택으로 뽕 뽑으려면 [옵션3] 강추! 💛혜택은 받으면서 적당량 먼저 써보고 싶으면 [옵션2]도 추천해요.  🔥개인적으로는 세라놀 앰플이 수분감이 쫀쫀하게 채워져서 좋았어요.   안녕하세요 여러분 콩빈입니다! 여행 후 다녀온 대전 본가 일상 영상을 가져왔어욤~! 가좍들이 선물을 다 맘에 들어해서 다행이었어욤ㅎ.ㅎ 작년에 동생 선물은 완전 심하게 사이즈 미스가 나서 굉장히 당황했었는데      ^^ㅋ 이번에는 성공적~! 아빠가 매년 벚꽃 필 때 드라이브를 해주시는데 넘 힐링되는 시간이었어요. 또 할머니  할아버지랑도 시간을 많이 보내서 참 좋았답니다. 워홀 가기 전까지 자주 대전에 가려구요!  그리고 미루고 미루던 호두의 발 미용 드디어 했습니다 후아ㅏㅏ🐶✂️ 호두는 발 만지는걸 유난히도 싫어하는 강쥐에요^_ㅠ 스트레스 받게 하고싶지 않아서 최대한 길게 텀을 두고 잘라준답니다. 산책을 자주 해서 발톱은 따로 자르지 않아도 항상 적당한 길이를 유지하고 있는데 유난히 긴게 하나 있더라고요? 발톱은 딱 그거 하나 잘랐는데 손이 벌벌 떨렸어요    혹시나 혈관쪽 건드려서 피 날까봐     🥺 어쨌거나 해피엔딩 대전 본가 방문이었답니다~~~~~~~~~🍀  오늘 영상도 재밌게 봐주셔서 감사해용 우리는 다음 영상에서 만나요~~!  블로그 : https://m.blog.naver.com/qlsgkfbs ⚡️문의 : qlsduswn9494@gmail.com  📸 CAMERA: iphone14pro  캐논 G7X mark2 🎞Program: Premiere Pro  #대전브이로그 #본가브이로그 #브이로그,s4eEyJWQ5ik,1591,2025-04-14T10:01:32.000Z,[콩빈 일상  콩빈브이로그  콩빈 대전  대전 브이로그  대전 여행  대전 혼카페  대전 혼밥  대전 핫플  대전 맛집  대전 성심당  대전 코스  대전 혼코스  먹는브이로그  먹방브이로그  vlog  daejeon vlog  본가브이로그  자취브이로그],대전의 딸  하와이 여행 후 컴백홈      ❤️‍🔥 여행 선물 증정식🎁 • 대청댐 벚꽃 나들이🌸 • 김밥 만들기 • 대전 카페추천 • 오겹살 맛집 • 노견 셀프미용🐶,https://www.youtube.com/watch?v=s4eEyJWQ5ik,72015
people_blogs,22,연늘,275,KR,* 이 영상은 '셀리맥스'의 광고를 포함하고 있습니다.  저의 찐템 노니앰플.. 🌱 이젠 없어서는 안된다구요..! 특가 + 노니마스크 증정 이벤트할 때 가져가보시길.. 🍀  ✨노니앰플 대용량 에어리스 100ml 특가✨ ▶ 대박 할인(~4/29) 👉 https://bit.ly/4iWv1RK 💚혜택1. 노니앰플 100ml 57%🔻 💚혜택2. 업그레이드된 노니마스크4매 + 17.5ml 추가 증정! 💚혜택3. 추가 할인 쿠폰 2종(5천원+1천원) 증정!  ✅구독자 댓글 참여 이벤트 참여 방법 : 노니앰플 기대평 댓글 작성 후 아래 폼 입력 참여 링크 : https://naver.me/FpxhRwFU - 이벤트 기간 : ~4/29(화) 23:59까지 - 당첨자 발표 : 5/8(목) 17시 *문자 개별 안내 - 선물 : 노니앰플 100ml 대용량 에어리스 (15명) 관련 문의 : neyoon@celimax.co.kr  —  instagram. https://instagram.com/uu.sa.gi blog. https://m.blog.naver.com/seoyeonhan_ contact. toyeonneul@gmail.com,S-ygZMhFed0,940,2025-04-15T12:15:06.000Z,,워홀 끝나고 반백수가 된 사람의 브이로그,https://www.youtube.com/watch?v=S-ygZMhFed0,45116
people_blogs,24,쏨따TV,7,KR,#트젠 #젠더 #트랜스젠더 #이태원 #젠더바 #켈리#엘쪽이TV #풍자 #꽃자 #장추자,XnEae-uRkLs,148,2025-04-17T16:12:54.000Z,,목 가게방송,https://www.youtube.com/watch?v=XnEae-uRkLs,37244
people_blogs,22,우림이씨,406,KR,#직장인일상 #사무직브이로그 #구독자이벤트  📮contact : summer.urim@gmail.com 💡instagram : @iam_urim ✍🏻 blog : https://blog.naver.com/iam_urim 🎧 Epidemic Sound  행찌덜 벚꽃 막차 탑승하셨나요 ❤️  주말에 비바람 씨게 불어서 벚꽃 다 떨어진다는 소식 듣고  전 금요일에 석촌호수가서 구경하고 왔는데 사람이 으마으마하게 많았지만 너무 예쁘더라구요!  이번주까지만 쌀쌀하구 담주부터 다시 따뜻해진다고 하니까  행찌덜 감기 조심하시구 영상에서 말씀드린 것처럼  빼바에서 구독자 이벤트를 준비해주셨으니까  꼭 참여하시구 제 최애 프로틴바 받아가세요..💕  오늘도 영상 보러와주셔서  너무 감사드리구 사   사   사월의 경주 가보고파  📌 우림 x 빼바 구독자 최저가 히든 링크 https://healthyplace.kr/product/detail.html?product_no=163 최저가 구매 가능기간 : 2025.04.15(화) ~ 2025.04.20(일) * 영상 업로드되는 오늘(14일)말고  내일부터 최저가니까  꼭 기간 체크하고 구매하세용!! 최최최최저가래요! 저도 쟁이러갑니다...❤️  📌 우림 x 빼바 구독자 이벤트 올리브영 1위 단백질바  빼바 리얼초콜릿 프로틴바 기대평을 댓글로 남겨주시면 추첨을 통해 '빼바 리얼초콜릿 프로틴바'를 드립니다! ✓ 영상 좋아요 + 댓글 남기기 구글폼 링크 내 배송 정보 작성 및 제출 https://forms.gle/cNdtTwvpoQm4Uw5x9 ✓ 참여 기간 : 4/14 (월) ~ 4/20(일)  7일간 ✓ 당첨자 발표 : 4/21(월)  더보기란 안내 예정 ✓ 빼바 리얼초콜릿 프로틴바 1box (9개입)  10명 선정  -  💛 00:00 𝙞𝙣𝙩𝙧𝙤  💛 00:14 𝘿𝙖𝙮 𝟭 OUTER. zara  TOP. MOTT / 보트넥 티셔츠 (White) https://www.mott.co.kr/T-shirt/?idx=203 BOTTOM. 어포인트 노운 / 찰릭 진청 데님  💛 11:15 𝘿𝙖𝙮 𝟮 OUTER. Babour / 비드넬 (네이비 컬러  사이즈 10) TOP. 콜미베이비 (단종...ㅠ.ㅠ) BOTTOM. che / Central Buckle Wide Pants (Charcoal) https://che-seoul.kr/product/central-buckle-wide-pants-charcoal/148/category/27/display/1/  💛 19:56 𝘿𝙖𝙮 𝟯 OUTER. COS  TOP. Yuppe / SHIRT COLLAR CARDIGAN (GRAY) https://yuppe.zvzo.store/Ntc79c BOTTOM. LIST / 품번 : TWWSLJ50110BK  💛19:16 𝘿𝙖𝙮 𝟰 TOP. Yuppe / ROUND TWEED JACKET https://yuppe.zvzo.store/nrYvk8 SKIRT. Yuppe / ROUND TWEED SKIRT https://yuppe.zvzo.store/w5PC2i SHOES. 쿠팡 / 모넬로 통굽 첼시 롱부츠 https://link.coupang.com/a/cor73f BAG. 보테가베네타 (단종)  - 𝒃𝒈𝒎 Epidemic Sound  * 노출의무 없는 단순 선물이 포함되어있습니다 (*표기) * 기재된 링크를 통한 수익의 일부를 지급 받을 수 있습니다.(ZVZO),0EOAZ-v0gQs,600,2025-04-14T10:30:01.000Z,[구독자이벤트  직장인 브이로그  직장인 일상  사무직 브이로그  사무직 일상  다이어트 프로틴바 추천  올리브영 프로틴바 추천  빼바 초코  프로틴바 추천  단백질 간식 추천  올리브영 단백질 간식 추천  올리브영 다이어트템 추천  여자 30대 출근룩 코디  빵지순례 브이로그  방배동 빵집 후기  레이어드컷 브이로그  레이어드컷 염색  중단발 염색  방배동 베이커리  바게틴 후기],사무직 일상 vlog. 구독자 이벤트 / 쿠팡 추천템 / 레이어드컷 염색 / 바게트 샌드위치 맛집  카페투어,https://www.youtube.com/watch?v=0EOAZ-v0gQs,24960
people_blogs,26,모염 moyeom,79,KR,◎ 이 영상은 유료광고를 포함하지 않습니다.  ═══════☆═══════  *0:00 timeline*    *0:59 day 1*    *1:37 ✿look(1)* *🌴 옷 정보 링크로 확인!* ( https://blog.naver.com/moyeom_222/223819643612 )  🏷️ cap  허그유어스킨 - 허그프렌즈 캡  50 400 / 차콜  🏷️ inner  마른파이브 - 캡내장 모달 브라캡 나시탑 (4/22 할인 마켓 예정) 11 900 / 2xl 그레이  🏷️ top 당당걸 - 칫챗 보트넥 오프숄더 레터링 프린팅 여리핏 긴팔 코튼 맨투맨 22 500 / 차콜 1  🏷️ pants 필루미네이트 - 데미지 워시드 데님 팬츠 블루 34 900 / summer xl  🏷️ shoes  크록스 - 클래식 플랫폼 클로그 55 990 / 260    *4:11 ✿look(2)* *🌴 옷 정보 링크로 확인!* ( https://blog.naver.com/moyeom_222/223819643612 )  🏷️ inner 마른파이브 - 캡내장 모달 브라캡 나시탑 (4/22 할인 마켓 예정) 11 900 / 2xl 그레이  🏷️ top 코코앤유 - 핑퐁퍼프 코코앤유블라우스 25 770 / 크림 4  🏷️ pants 리치무드 - 043 스판 빈티지 부츠컷 p 39 010 / 38  🏷️ skirt 당당걸 - 파이튼 빈티지 워싱 데님 레이어드 랩 미니 스커트 25 110 / 4  🏷️ necklace odds&ends - berry beads necklace 20 000 / blueberry  🏷️ acc 샵사이다 - FLORAL EMBROIDERED HEADBAND 11 700 / 블랙  🏷️ shoes 크록스 - 클래식 플랫폼 클로그 55 990 / 260    *13:54 ✿look(3)* *🌴 옷 정보 링크로 확인!* ( https://blog.naver.com/moyeom_222/223819643612 )  🏷️ inner 마른파이브 - 캡내장 모달 브라캡 나시탑 (4/22 할인 마켓 예정) 11 900 / 2xl 그레이  🏷️ top 샵사이다 - LACE RUFFLE HEM KNOTTED TOP CURVE & PLUS 26 000 / 베이지 110(0xl)  🏷️ outer 당당걸 - 리본즈 린넨 볼레로 가디건 15 480 / 네추럴  🏷️ pants 리치무드 - 043 스판 빈티지 부츠컷 p 39 010 / 38  🏷️ necklace odds&ends - berry beads necklace 20 000 / blueberry  🏷️ bag 스컬프터 - expandable hobo bag ice 87 200  🏷️ shoes 크록스 - 클래식 플랫폼 클로그 55 990 / 260    *15:54 day 2*    *17:23 ✿look(4)* *🌴 옷 정보 링크로 확인!* ( https://blog.naver.com/moyeom_222/223819679147 )  🏷️ top 쉬인 - Swim Lushoire 플러스 사이즈 여성 솔리드 수영복 11 290 / 브라운 2xl  🏷️ outer  페스토 - 판매종료   🏷️ pants 더마일 - 엠엘 나일론 와이드 벌룬 스트링 팬츠  53 590 / 베이지 L  🏷️ necklace odds&ends - berry beads necklace  20 000 / blueberry  🏷️ shoes  크록스 - 클래식 플랫폼 클로그  55 990 / 260     *21:23 ✿look(5)* *🌴 옷 정보 링크로 확인!* ( https://blog.naver.com/moyeom_222/223819679147 )  🏷️ top 쉬인 - Swim Basics 플러스 사이즈 매듭 프론트 플리츠 바스트 원피스 수영복 11 890 / 아미그린 1xl  🏷️ outer 당당걸 - [1천장돌파][MADE] 빅사이즈 44-99 러빙 체인 볼레로 가디건 16 650 / 아이보리 2   🏷️ pants 더마일 - 엠엘 나일론 와이드 벌룬 스트링 팬츠  53 590 / 베이지 L  🏷️ cap 테무 - 빈티지 워시드 코튼 베이스볼 캡 3 800 / 카키색 옷감  🏷️ shoes  keen - 뉴포트 h2 샌들 triple black  169 000     *25:20 day 3*    *26:05 ✿look(6)* *🌴 옷 정보 링크로 확인!* ( https://blog.naver.com/moyeom_222/223819700729 )  🏷️ top  쉬인 - SHEIN Swim Curve 플러스 사이즈 러플 스트랩 끈조임 솔리드 컬러 귀여운 비키니 수영복 세트 여름 14 690 / 화이트 2xl  🏷️ outer  언니살롱 - [55-99][SHEERLY]레이스 트랙 바람막이 점퍼(2color) 63 530 / 블랙 2  🏷️ pants 페스토 - 라이트 디스트로이드 진 38 340 / 2xl   🏷️ cap 하우스오브낭만 - '행복' 자수 딥 체리 핑크 볼캡  58 000  🏷️ bag 유니클로 - 라운드 미니 숄더백  19 900 / 오프화이트  🏷️ shoes  크록스 - 클래식 플랫폼 클로그  55 990 / 260    *27:39 ✿look(7)* *🌴 옷 정보 링크로 확인!* ( https://blog.naver.com/moyeom_222/223819700729 )  🏷️ top  Swim Vcay 플러스 사이즈 여성용 플레인 1피스 수영복  여름 일상 착용용 10 690 / 네이비 블루 2xl  🏷️ pants 페스토 - 라이트 디스트로이드 진 38 340 / 2xl   🏷️ acc odds&ends - berry beads necklace  20 000 / blueberry  🏷️ sunglass 리끌로우 - RC TR BB102 BLACK 선글라스 27 900  🏷️ shoes  keen - 뉴포트 h2 샌들 triple black  169 000     *30:59 ✿look(8)* *🌴 옷 정보 링크로 확인!* ( https://blog.naver.com/moyeom_222/223819721251 )  🏷️ top  샵사이다 - halter necklace patchy short  22 100 / 커피 1xl  🏷️ pants 당당걸 - [MADE] 빅사이즈 S-4XL 로이반 코튼 7부 버뮤다 뒷밴딩 하프 팬츠 25 020 / 아이보리 4  🏷️ acc 히피와이 - dolphin 돌고래 원석 목걸이 끈 가죽 매듭 빈티지 히피  18 900  🏷️ bag 스컬프터 - expandable hobo bag ice  87 200   🏷️ shoes  크록스 - 클래식 플랫폼 클로그  55 990 / 260     *34:09 day 4*    *34:46 ✿look(9)* *🌴 옷 정보 링크로 확인!* ( https://blog.naver.com/moyeom_222/223819721251 )  🏷️ top  블루팝스 - 베이스 유넥 반팔티 TS9750 ONLY BLUEPOPS 19 000 / 3  🏷️ pants 당당걸 - [MADE] 빅사이즈 M-4XL 올밴딩 데님 트랙 배색 라인 투웨이 스트링 메가 와이드 파라슈트 팬츠 청바지 36 180 / 2  🏷️ skirt  리치무드 - 베키 frill wrap layerd sk (2color) 14 130 / 블랙   🏷️ acc  페스토 - [빅사이즈가능] 아일렛 롱 벨트 12 000  🏷️ sunglass 리끌로우 - RC TR BB102 BLACK 선글라스 27 900  🏷️ shoes  크록스 - 클래식 플랫폼 클로그  55 990 / 260     *39:53 photodump*  ═══════☆═══════  ✷ 𝗖𝗼𝗻𝘁𝗮𝗰𝘁  𝗶𝗻𝘀𝘁𝗮𝗴𝗿𝗮𝗺 @moyeom.y 𝗲-𝗺𝗮𝗶𝗹 moyeom@videovillage.co.kr  ✷ 𝗔𝗯𝗼𝘂𝘁 𝗺𝗲 166cm  90kg  88size-99size top : XL-2XL bottom : 34-36 size shoes : 245-250  bust : 110 cm  ✷ 𝗘𝗱𝗶𝘁 Adobe premire pro CC 2025  ✷ 𝗖𝗮𝗺𝗲𝗿𝗮 iPhone 14 PRO MAX  DJI Pocket2 ✷ © 2025 by moyeom All rights reserved,ONyotY8Cg6k,704,2025-04-15T14:10:21.000Z,[빅사이즈  데일리룩  빅사이즈코디  빅사이즈데일리룩  통통코디  뚱뚱코디  오오티디  ootd  fashion],영원히 괌을 그리워하게 되..🌴 4일동안 옷만 9번 갈아입는(ㅎㅎ) 16년지기 패션 진심녀 둘의 현실도피 괌 3박 4일 | 빅사이즈 여름 휴양지 여행 코디  수영복 추천,https://www.youtube.com/watch?v=ONyotY8Cg6k,31057
people_blogs,22,НИКОЛАЙ ПО-КОРЕЙСКИ,1749,KR,В сегодняшнем видео мы посетили с корейцем огромный гипермаркет в России. Какие продукты мы взяли и какие были впечатления у Дасоля - смотрите далее. Пишите своё мнение в комментариях и ставьте лайки!  Поддержи канал: Мы на boosty: https://boosty.to/nickkorea  Мой лайфстайл в Ин$ta: https://www.instagram.com/n.park134/?igshid=YmMyMTA2M2Y%3D  Знакомьтесь  канал моей Виктории :  https://www.youtube.com/channel/UC5dt5nrI6uon507fixL0Bag   Есть вопросы по покупке авто из Кореи? пишите сюда: https://t.me/nikolauto  Моя телега: https://t.me/nikolaipak  Подписывайтесь на меня в Дзене:  https://dzen.ru/id/63633e5d4944057bca9fe969  00:00 Вступление 01:07 Приехали в огромный гипермаркет 02:12 Первая реакция корейца 03:24 Зашли в продуктовый 04:02 Отдел с алкоголем 06:51 Важная информация 07:45 Очень много тортов 08:42 Любимые круассаны корейца 09:18 Огромный отдел со сладостями 13:00 Рекомендую чай корейцу 13:50 Гуляем по магазину 16:22 Отдел с азиатской едой 17:23 Зашли в молочный отдел 19:44 Красивые русские девушки 20:58 Оплачиваем продукты 22:55 Впечатления корейца от магазина 25:54 Заключение  #корея #россия #корейцы #москва #путешествие #семейныйвлог,9OVqHk2xrV4,15786,2025-04-05T12:00:11.000Z,[кукинг  готовим дома  рецепты  корейская кухня  корейские блюда  виктория ким  корея влог  корейская еда  корейцы на русском  жизнь в корее  кимчи по-корейски  фуд блогер  суп по-корейски  закуска по-корейски  доставка еды в Корее  мукбанг  асмр  уличная еда  айдолы в Корее  nick park  работа в корее  корейцы в москве  авто из кореи  корея  дружба с корейцем  корейские парни  еда в корее  николай корея  сеул  дорамы  кпоп  авто в корее  москва  россия  покупки продуктов],КОРЕЕЦ ОБАЛДЕЛ от выбора еды в русском гипермаркете / ищем гостинцы для родных в Корею@paknikolay,https://www.youtube.com/watch?v=9OVqHk2xrV4,486442
people_blogs,24,Lâm Vlog,388,KR,Tụi mình LiveStream chơi cờ tỷ phú khổng lồ bằng tiền thật  Facebook của mình nè: https://www.facebook.com/vuhuy1990  FanPage Facebook: https://www.facebook.com/LamVlog  Tiktok: https://www.tiktok.com/@lamvlog  🔰[Vlog No Copyright Music] https://www.youtube.com/c/vlognocopyrightmusic  🔰[TheFatRat] https://facebook.com/thisisthefatrat https://twitter.com/ThisIsTheFatRat https://instagram.com/thefatratofficial https://soundcloud.com/thefatrat https://www.youtube.com/c/thefatrat  🔰 [UXN]  https://soundcloud.com/uxntv https://www.facebook.com/uxntv https://www.youtube.com/c/uxntv http://www.uxnrecords.com  🔰[Kevin MacLeod] https://incompetech.com,H5WILjKw2iw,26455,2025-03-28T13:35:30.000Z,,🔴 [LIVE] Chơi Cờ Tỷ Phú Khổng Lồ Bằng Tiền Thật,https://www.youtube.com/watch?v=H5WILjKw2iw,1327656
people_blogs,24,Lâm TV,415,KR,24h Sinh Tồn Trên Bãi Biển  Các Video Liên Quan: 24h Sinh Tồn Trên Đảo Hoang https://youtu.be/1vm9ZWqORqg  → Facebook cá nhân: https://www.facebook.com/vuhuy1990  → FanPage Facebook: https://www.facebook.com/LamVlog  → Tiktok: https://www.tiktok.com/@lamvlog  → Liên hệ Quảng Cáo: ChauNguyen@LamVlog.com (Mrs. Châu)  🔰[Vlog No Copyright Music] https://www.youtube.com/c/vlognocopyrightmusic  🔰[TheFatRat] https://facebook.com/thisisthefatrat https://twitter.com/ThisIsTheFatRat https://instagram.com/thefatratofficial https://soundcloud.com/thefatrat https://www.youtube.com/c/thefatrat  🔰 [UXN]  https://soundcloud.com/uxntv https://www.facebook.com/uxntv https://www.youtube.com/c/uxntv http://www.uxnrecords.com  🔰[Kevin MacLeod] https://incompetech.com,1cziBAOPZ2E,18693,2025-03-19T23:18:46.000Z,[lâm tv  lam tv  lâmtv  lamtv  lâm vlog  lamvlog  lam vlog  24h Sinh Tồn Trên Bãi Biển  Sinh Tồn Trên Bãi Biển  24h Sinh Tồn  24h  Sinh Tồn  Trên Bãi Biển  24h Sinh Tồn Bãi Biển  Sinh Tồn Bãi Biển  24h Bãi Biển  24h Trên Bãi Biển  Bãi Biển  Sinh Tồn Trên Biển  24h Sinh Tồn Trên Biển  24h Trên Biển],24h Sinh Tồn Trên Bãi Biển,https://www.youtube.com/watch?v=1cziBAOPZ2E,1037352
